resnet18-cuda.log
{"i": [["[\"113370991bc27f5cd1de28d21f562292\", [1, 64, 56, 56], [128, 64, 3, 3], [1, 128, 28, 28]]", "cuda -keys=cuda,gpu -arch=sm_75 -max_num_threads=1024 -thread_warp_size=32", [-1, 16, 64, 49152, 2147483647, 1024, 8, 32], "", 0, []], [[], [["CI", 12], ["CI", 11], ["CI", 10], ["CI", 9], ["CI", 8], ["CI", 7], ["CI", 6], ["CHW", 5, "local"], ["SP", 5, 0, 1, [1, 1, 1, 1], 1], ["SP", 5, 5, 32, [1, 32, 1, 1], 1], ["SP", 5, 10, 28, [7, 1, 4, 1], 1], ["SP", 5, 15, 28, [1, 1, 14, 2], 1], ["SP", 5, 20, 4, [1, 4, 1, 1], 1], ["SP", 5, 25, 16, [1, 8], 1], ["SP", 5, 28, 3, [1, 3], 1], ["SP", 5, 31, 3, [1, 3], 1], ["SP", 5, 34, 4, [1, 1], 1], ["RE", 5, [0, 5, 10, 15, 20, 1, 6, 11, 16, 21, 2, 7, 12, 17, 22, 25, 28, 31, 34, 26, 29, 32, 35, 3, 8, 13, 18, 23, 27, 30, 33, 36, 4, 9, 14, 19, 24]], ["FSP", 6, 0, 8, 3], ["FSP", 6, 4, 9, 3], ["FSP", 6, 8, 10, 3], ["FSP", 6, 12, 11, 3], ["FSP", 6, 16, 12, 3], ["RE", 6, [0, 4, 8, 12, 16, 1, 5, 9, 13, 17, 2, 6, 10, 14, 18, 3, 7, 11, 15, 19]], ["CA", 5, 6, 14], ["CHR", 4, "shared", [5]], ["CA", 5, 6, 18], ["CI", 4], ["CHR", 2, "shared", [6]], ["CA", 3, 7, 18], ["CI", 2], ["CI", 1], ["FU", 16, [0, 1, 2, 3]], ["SP", 16, 0, 100352, [4], 1], ["AN", 16, 0, 5], ["AN", 16, 1, 6], ["FU", 8, [0, 1, 2, 3, 4]], ["AN", 8, 0, 5], ["FU", 8, [1, 2, 3, 4, 5]], ["AN", 8, 1, 4], ["FU", 8, [2, 3, 4, 5, 6]], ["AN", 8, 2, 6], ["FU", 6, [0, 1, 2, 3, 4, 5]], ["SP", 6, 0, 24, [1], 1], ["AN", 6, 1, 2], ["FFSP", 6, 0, [12, 11, 10, 9, 8], 1, 1], ["AN", 6, 1, 6], ["FU", 3, [0, 1, 2, 3, 4]], ["SP", 3, 0, 3192, [1], 1], ["AN", 3, 1, 2], ["FFSP", 3, 0, [12, 11, 10, 9, 8], 1, 1], ["AN", 3, 1, 6], ["PR", 7, 0, "auto_unroll_max_step$16"]]]], "r": [[0.00258686], 0, 5.85952, 1722425004], "v": "v0.6"}
{"i": [["[\"113370991bc27f5cd1de28d21f562292\", [1, 64, 56, 56], [128, 64, 3, 3], [1, 128, 28, 28]]", "cuda -keys=cuda,gpu -arch=sm_75 -max_num_threads=1024 -thread_warp_size=32", [-1, 16, 64, 49152, 2147483647, 1024, 8, 32], "", 0, []], [[], [["CI", 12], ["CI", 11], ["CI", 10], ["CI", 9], ["CI", 8], ["CI", 7], ["CI", 6], ["CHW", 5, "local"], ["SP", 5, 0, 1, [1, 1, 1, 1], 1], ["SP", 5, 5, 32, [1, 1, 8, 4], 1], ["SP", 5, 10, 28, [2, 14, 1, 1], 1], ["SP", 5, 15, 28, [1, 7, 2, 1], 1], ["SP", 5, 20, 4, [2, 2, 1, 1], 1], ["SP", 5, 25, 16, [1, 2], 1], ["SP", 5, 28, 3, [1, 1], 1], ["SP", 5, 31, 3, [1, 3], 1], ["SP", 5, 34, 4, [1, 4], 1], ["RE", 5, [0, 5, 10, 15, 20, 1, 6, 11, 16, 21, 2, 7, 12, 17, 22, 25, 28, 31, 34, 26, 29, 32, 35, 3, 8, 13, 18, 23, 27, 30, 33, 36, 4, 9, 14, 19, 24]], ["FSP", 6, 0, 8, 3], ["FSP", 6, 4, 9, 3], ["FSP", 6, 8, 10, 3], ["FSP", 6, 12, 11, 3], ["FSP", 6, 16, 12, 3], ["RE", 6, [0, 4, 8, 12, 16, 1, 5, 9, 13, 17, 2, 6, 10, 14, 18, 3, 7, 11, 15, 19]], ["CA", 5, 6, 14], ["CHR", 4, "shared", [5]], ["CA", 5, 6, 18], ["CI", 4], ["CHR", 2, "shared", [6]], ["CA", 3, 7, 18], ["CI", 2], ["CI", 1], ["FU", 16, [0, 1, 2, 3]], ["SP", 16, 0, 100352, [32], 1], ["AN", 16, 0, 5], ["AN", 16, 1, 6], ["FU", 8, [0, 1, 2, 3, 4]], ["AN", 8, 0, 5], ["FU", 8, [1, 2, 3, 4, 5]], ["AN", 8, 1, 4], ["FU", 8, [2, 3, 4, 5, 6]], ["AN", 8, 2, 6], ["FU", 6, [0, 1, 2, 3, 4, 5]], ["SP", 6, 0, 384, [1], 1], ["AN", 6, 1, 2], ["FFSP", 6, 0, [12, 11, 10, 9, 8], 1, 1], ["AN", 6, 1, 6], ["FU", 3, [0, 1, 2, 3, 4]], ["SP", 3, 0, 60, [1], 1], ["AN", 3, 1, 2], ["FFSP", 3, 0, [12, 11, 10, 9, 8], 1, 1], ["AN", 3, 1, 6], ["PR", 7, 0, "auto_unroll_max_step$512"]]]], "r": [[0.000460703], 0, 9.66942, 1722425005], "v": "v0.6"}
{"i": [["[\"113370991bc27f5cd1de28d21f562292\", [1, 64, 56, 56], [128, 64, 3, 3], [1, 128, 28, 28]]", "cuda -keys=cuda,gpu -arch=sm_75 -max_num_threads=1024 -thread_warp_size=32", [-1, 16, 64, 49152, 2147483647, 1024, 8, 32], "", 0, []], [[], [["CI", 12], ["CI", 11], ["CI", 10], ["CI", 9], ["CI", 8], ["CI", 7], ["CI", 6], ["CHW", 5, "local"], ["SP", 5, 0, 1, [1, 1, 1, 1], 1], ["SP", 5, 5, 32, [2, 1, 1, 1], 1], ["SP", 5, 10, 28, [2, 7, 1, 1], 1], ["SP", 5, 15, 28, [1, 7, 1, 1], 1], ["SP", 5, 20, 4, [1, 1, 1, 1], 1], ["SP", 5, 25, 16, [4, 1], 1], ["SP", 5, 28, 3, [3, 1], 1], ["SP", 5, 31, 3, [1, 3], 1], ["SP", 5, 34, 4, [4, 1], 1], ["RE", 5, [0, 5, 10, 15, 20, 1, 6, 11, 16, 21, 2, 7, 12, 17, 22, 25, 28, 31, 34, 26, 29, 32, 35, 3, 8, 13, 18, 23, 27, 30, 33, 36, 4, 9, 14, 19, 24]], ["FSP", 6, 0, 8, 3], ["FSP", 6, 4, 9, 3], ["FSP", 6, 8, 10, 3], ["FSP", 6, 12, 11, 3], ["FSP", 6, 16, 12, 3], ["RE", 6, [0, 4, 8, 12, 16, 1, 5, 9, 13, 17, 2, 6, 10, 14, 18, 3, 7, 11, 15, 19]], ["CA", 5, 6, 14], ["CHR", 4, "shared", [5]], ["CA", 5, 6, 18], ["CI", 4], ["CHR", 2, "shared", [6]], ["CA", 3, 7, 18], ["CI", 2], ["CI", 1], ["FU", 16, [0, 1, 2, 3]], ["SP", 16, 0, 100352, [64], 1], ["AN", 16, 0, 5], ["AN", 16, 1, 6], ["FU", 8, [0, 1, 2, 3, 4]], ["AN", 8, 0, 5], ["FU", 8, [1, 2, 3, 4, 5]], ["AN", 8, 1, 4], ["FU", 8, [2, 3, 4, 5, 6]], ["AN", 8, 2, 6], ["FU", 6, [0, 1, 2, 3, 4, 5]], ["SP", 6, 0, 144, [1], 1], ["AN", 6, 1, 2], ["FFSP", 6, 0, [12, 11, 10, 9, 8], 1, 1], ["AN", 6, 1, 6], ["FU", 3, [0, 1, 2, 3, 4]], ["SP", 3, 0, 144, [1], 1], ["AN", 3, 1, 2], ["FFSP", 3, 0, [12, 11, 10, 9, 8], 1, 1], ["AN", 3, 1, 6], ["PR", 7, 0, "auto_unroll_max_step$512"]]]], "r": [[0.000567811], 0, 9.55743, 1722425006], "v": "v0.6"}
{"i": [["[\"113370991bc27f5cd1de28d21f562292\", [1, 64, 56, 56], [128, 64, 3, 3], [1, 128, 28, 28]]", "cuda -keys=cuda,gpu -arch=sm_75 -max_num_threads=1024 -thread_warp_size=32", [-1, 16, 64, 49152, 2147483647, 1024, 8, 32], "", 0, []], [[], [["CI", 12], ["CI", 11], ["CI", 10], ["CI", 9], ["CI", 8], ["CI", 7], ["CI", 6], ["CHW", 5, "local"], ["SP", 5, 0, 1, [1, 1, 1, 1], 1], ["SP", 5, 5, 32, [1, 4, 2, 1], 1], ["SP", 5, 10, 28, [1, 2, 1, 2], 1], ["SP", 5, 15, 28, [1, 7, 4, 1], 1], ["SP", 5, 20, 4, [1, 1, 1, 2], 1], ["SP", 5, 25, 16, [1, 8], 1], ["SP", 5, 28, 3, [1, 3], 1], ["SP", 5, 31, 3, [3, 1], 1], ["SP", 5, 34, 4, [4, 1], 1], ["RE", 5, [0, 5, 10, 15, 20, 1, 6, 11, 16, 21, 2, 7, 12, 17, 22, 25, 28, 31, 34, 26, 29, 32, 35, 3, 8, 13, 18, 23, 27, 30, 33, 36, 4, 9, 14, 19, 24]], ["FSP", 6, 0, 8, 3], ["FSP", 6, 4, 9, 3], ["FSP", 6, 8, 10, 3], ["FSP", 6, 12, 11, 3], ["FSP", 6, 16, 12, 3], ["RE", 6, [0, 4, 8, 12, 16, 1, 5, 9, 13, 17, 2, 6, 10, 14, 18, 3, 7, 11, 15, 19]], ["CA", 5, 6, 14], ["CHR", 4, "shared", [5]], ["CA", 5, 6, 18], ["CI", 4], ["CHR", 2, "shared", [6]], ["CA", 3, 7, 18], ["CI", 2], ["CI", 1], ["FU", 16, [0, 1, 2, 3]], ["SP", 16, 0, 100352, [32], 1], ["AN", 16, 0, 5], ["AN", 16, 1, 6], ["FU", 8, [0, 1, 2, 3, 4]], ["AN", 8, 0, 5], ["FU", 8, [1, 2, 3, 4, 5]], ["AN", 8, 1, 4], ["FU", 8, [2, 3, 4, 5, 6]], ["AN", 8, 2, 6], ["FU", 6, [0, 1, 2, 3, 4, 5]], ["SP", 6, 0, 1152, [1], 1], ["AN", 6, 1, 2], ["FFSP", 6, 0, [12, 11, 10, 9, 8], 1, 1], ["AN", 6, 1, 6], ["FU", 3, [0, 1, 2, 3, 4]], ["SP", 3, 0, 800, [1], 1], ["AN", 3, 1, 2], ["FFSP", 3, 0, [12, 11, 10, 9, 8], 1, 1], ["AN", 3, 1, 6], ["PR", 7, 0, "auto_unroll_max_step$64"]]]], "r": [[0.00030462], 0, 2.81423, 1722425007], "v": "v0.6"}
{"i": [["[\"113370991bc27f5cd1de28d21f562292\", [1, 64, 56, 56], [128, 64, 3, 3], [1, 128, 28, 28]]", "cuda -keys=cuda,gpu -arch=sm_75 -max_num_threads=1024 -thread_warp_size=32", [-1, 16, 64, 49152, 2147483647, 1024, 8, 32], "", 0, []], [[], [["CI", 12], ["CI", 11], ["CI", 10], ["CI", 9], ["CI", 8], ["CI", 7], ["CI", 6], ["CHW", 5, "local"], ["SP", 5, 0, 1, [1, 1, 1, 1], 1], ["SP", 5, 5, 32, [1, 8, 2, 2], 1], ["SP", 5, 10, 28, [1, 1, 4, 1], 1], ["SP", 5, 15, 28, [1, 2, 14, 1], 1], ["SP", 5, 20, 4, [1, 2, 1, 1], 1], ["SP", 5, 25, 16, [4, 1], 1], ["SP", 5, 28, 3, [1, 1], 1], ["SP", 5, 31, 3, [1, 1], 1], ["SP", 5, 34, 4, [1, 4], 1], ["RE", 5, [0, 5, 10, 15, 20, 1, 6, 11, 16, 21, 2, 7, 12, 17, 22, 25, 28, 31, 34, 26, 29, 32, 35, 3, 8, 13, 18, 23, 27, 30, 33, 36, 4, 9, 14, 19, 24]], ["FSP", 6, 0, 8, 3], ["FSP", 6, 4, 9, 3], ["FSP", 6, 8, 10, 3], ["FSP", 6, 12, 11, 3], ["FSP", 6, 16, 12, 3], ["RE", 6, [0, 4, 8, 12, 16, 1, 5, 9, 13, 17, 2, 6, 10, 14, 18, 3, 7, 11, 15, 19]], ["CA", 5, 6, 14], ["CHR", 4, "shared", [5]], ["CA", 5, 6, 18], ["CI", 4], ["CHR", 2, "shared", [6]], ["CA", 3, 7, 18], ["CI", 2], ["CI", 1], ["FU", 16, [0, 1, 2, 3]], ["SP", 16, 0, 100352, [32], 1], ["AN", 16, 0, 5], ["AN", 16, 1, 6], ["FU", 8, [0, 1, 2, 3, 4]], ["AN", 8, 0, 5], ["FU", 8, [1, 2, 3, 4, 5]], ["AN", 8, 1, 4], ["FU", 8, [2, 3, 4, 5, 6]], ["AN", 8, 2, 6], ["FU", 6, [0, 1, 2, 3, 4, 5]], ["SP", 6, 0, 128, [1], 1], ["AN", 6, 1, 2], ["FFSP", 6, 0, [12, 11, 10, 9, 8], 1, 1], ["AN", 6, 1, 6], ["FU", 3, [0, 1, 2, 3, 4]], ["SP", 3, 0, 6048, [1], 1], ["AN", 3, 1, 2], ["FFSP", 3, 0, [12, 11, 10, 9, 8], 1, 1], ["AN", 3, 1, 6], ["PR", 7, 0, "auto_unroll_max_step$0"]]]], "r": [[0.00131346], 0, 3.11491, 1722425007], "v": "v0.6"}
{"i": [["[\"113370991bc27f5cd1de28d21f562292\", [1, 64, 56, 56], [128, 64, 3, 3], [1, 128, 28, 28]]", "cuda -keys=cuda,gpu -arch=sm_75 -max_num_threads=1024 -thread_warp_size=32", [-1, 16, 64, 49152, 2147483647, 1024, 8, 32], "", 0, []], [[], [["CI", 12], ["CI", 11], ["CI", 10], ["CI", 9], ["CI", 8], ["CI", 7], ["CI", 6], ["CHW", 5, "local"], ["SP", 5, 0, 1, [1, 1, 1, 1], 1], ["SP", 5, 5, 32, [1, 32, 1, 1], 1], ["SP", 5, 10, 28, [1, 7, 4, 1], 1], ["SP", 5, 15, 28, [1, 1, 14, 2], 1], ["SP", 5, 20, 4, [1, 4, 1, 1], 1], ["SP", 5, 25, 16, [1, 8], 1], ["SP", 5, 28, 3, [1, 1], 1], ["SP", 5, 31, 3, [1, 3], 1], ["SP", 5, 34, 4, [1, 1], 1], ["RE", 5, [0, 5, 10, 15, 20, 1, 6, 11, 16, 21, 2, 7, 12, 17, 22, 25, 28, 31, 34, 26, 29, 32, 35, 3, 8, 13, 18, 23, 27, 30, 33, 36, 4, 9, 14, 19, 24]], ["FSP", 6, 0, 8, 3], ["FSP", 6, 4, 9, 3], ["FSP", 6, 8, 10, 3], ["FSP", 6, 12, 11, 3], ["FSP", 6, 16, 12, 3], ["RE", 6, [0, 4, 8, 12, 16, 1, 5, 9, 13, 17, 2, 6, 10, 14, 18, 3, 7, 11, 15, 19]], ["CA", 5, 6, 14], ["CHR", 4, "shared", [5]], ["CA", 5, 6, 18], ["CI", 4], ["CHR", 2, "shared", [6]], ["CA", 3, 7, 18], ["CI", 2], ["CI", 1], ["FU", 16, [0, 1, 2, 3]], ["SP", 16, 0, 100352, [32], 1], ["AN", 16, 0, 5], ["AN", 16, 1, 6], ["FU", 8, [0, 1, 2, 3, 4]], ["AN", 8, 0, 5], ["FU", 8, [1, 2, 3, 4, 5]], ["AN", 8, 1, 4], ["FU", 8, [2, 3, 4, 5, 6]], ["AN", 8, 2, 6], ["FU", 6, [0, 1, 2, 3, 4, 5]], ["SP", 6, 0, 24, [1], 1], ["AN", 6, 1, 2], ["FFSP", 6, 0, [12, 11, 10, 9, 8], 1, 1], ["AN", 6, 1, 6], ["FU", 3, [0, 1, 2, 3, 4]], ["SP", 3, 0, 3192, [1], 1], ["AN", 3, 1, 2], ["FFSP", 3, 0, [12, 11, 10, 9, 8], 1, 1], ["AN", 3, 1, 6], ["PR", 7, 0, "auto_unroll_max_step$16"]]]], "r": [[0.00203116], 0, 2.93076, 1722425019], "v": "v0.6"}
{"i": [["[\"113370991bc27f5cd1de28d21f562292\", [1, 64, 56, 56], [128, 64, 3, 3], [1, 128, 28, 28]]", "cuda -keys=cuda,gpu -arch=sm_75 -max_num_threads=1024 -thread_warp_size=32", [-1, 16, 64, 49152, 2147483647, 1024, 8, 32], "", 0, []], [[], [["CI", 12], ["CI", 11], ["CI", 10], ["CI", 9], ["CI", 8], ["CI", 7], ["CI", 6], ["CHW", 5, "local"], ["SP", 5, 0, 1, [1, 1, 1, 1], 1], ["SP", 5, 5, 32, [1, 8, 1, 4], 1], ["SP", 5, 10, 28, [4, 1, 1, 1], 1], ["SP", 5, 15, 28, [1, 7, 1, 2], 1], ["SP", 5, 20, 4, [1, 1, 2, 2], 1], ["SP", 5, 25, 16, [2, 4], 1], ["SP", 5, 28, 3, [1, 3], 1], ["SP", 5, 31, 3, [3, 1], 1], ["SP", 5, 34, 4, [2, 2], 1], ["RE", 5, [0, 5, 10, 15, 20, 1, 6, 11, 16, 21, 2, 7, 12, 17, 22, 25, 28, 31, 34, 26, 29, 32, 35, 3, 8, 13, 18, 23, 27, 30, 33, 36, 4, 9, 14, 19, 24]], ["FSP", 6, 0, 8, 3], ["FSP", 6, 4, 9, 3], ["FSP", 6, 8, 10, 3], ["FSP", 6, 12, 11, 3], ["FSP", 6, 16, 12, 3], ["RE", 6, [0, 4, 8, 12, 16, 1, 5, 9, 13, 17, 2, 6, 10, 14, 18, 3, 7, 11, 15, 19]], ["CA", 5, 6, 14], ["CHR", 4, "shared", [5]], ["CA", 5, 6, 18], ["CI", 4], ["CHR", 2, "shared", [6]], ["CA", 3, 7, 18], ["CI", 2], ["CI", 1], ["FU", 16, [0, 1, 2, 3]], ["SP", 16, 0, 100352, [4], 1], ["AN", 16, 0, 5], ["AN", 16, 1, 6], ["FU", 8, [0, 1, 2, 3, 4]], ["AN", 8, 0, 5], ["FU", 8, [1, 2, 3, 4, 5]], ["AN", 8, 1, 4], ["FU", 8, [2, 3, 4, 5, 6]], ["AN", 8, 2, 6], ["FU", 6, [0, 1, 2, 3, 4, 5]], ["SP", 6, 0, 2304, [4], 1], ["AN", 6, 1, 2], ["FFSP", 6, 0, [12, 11, 10, 9, 8], 1, 1], ["AN", 6, 1, 6], ["FU", 3, [0, 1, 2, 3, 4]], ["SP", 3, 0, 480, [5], 1], ["AN", 3, 1, 2], ["FFSP", 3, 0, [12, 11, 10, 9, 8], 1, 1], ["AN", 3, 1, 6], ["PR", 7, 0, "auto_unroll_max_step$64"]]]], "r": [[0.000288474], 0, 4.23001, 1722425020], "v": "v0.6"}
{"i": [["[\"113370991bc27f5cd1de28d21f562292\", [1, 64, 56, 56], [128, 64, 3, 3], [1, 128, 28, 28]]", "cuda -keys=cuda,gpu -arch=sm_75 -max_num_threads=1024 -thread_warp_size=32", [-1, 16, 64, 49152, 2147483647, 1024, 8, 32], "", 0, []], [[], [["CI", 12], ["CI", 11], ["CI", 10], ["CI", 9], ["CI", 8], ["CI", 7], ["CI", 6], ["CHW", 5, "local"], ["SP", 5, 0, 1, [1, 1, 1, 1], 1], ["SP", 5, 5, 32, [2, 1, 1, 1], 1], ["SP", 5, 10, 28, [2, 7, 1, 1], 1], ["SP", 5, 15, 28, [1, 7, 1, 1], 1], ["SP", 5, 20, 4, [1, 1, 1, 1], 1], ["SP", 5, 25, 16, [4, 1], 1], ["SP", 5, 28, 3, [3, 1], 1], ["SP", 5, 31, 3, [1, 3], 1], ["SP", 5, 34, 4, [4, 1], 1], ["RE", 5, [0, 5, 10, 15, 20, 1, 6, 11, 16, 21, 2, 7, 12, 17, 22, 25, 28, 31, 34, 26, 29, 32, 35, 3, 8, 13, 18, 23, 27, 30, 33, 36, 4, 9, 14, 19, 24]], ["FSP", 6, 0, 8, 3], ["FSP", 6, 4, 9, 3], ["FSP", 6, 8, 10, 3], ["FSP", 6, 12, 11, 3], ["FSP", 6, 16, 12, 3], ["RE", 6, [0, 4, 8, 12, 16, 1, 5, 9, 13, 17, 2, 6, 10, 14, 18, 3, 7, 11, 15, 19]], ["CA", 5, 6, 14], ["CHR", 4, "shared", [5]], ["CA", 5, 6, 18], ["CI", 4], ["CHR", 2, "shared", [6]], ["CA", 3, 7, 18], ["CI", 2], ["CI", 1], ["FU", 16, [0, 1, 2, 3]], ["SP", 16, 0, 100352, [64], 1], ["AN", 16, 0, 5], ["AN", 16, 1, 6], ["FU", 8, [0, 1, 2, 3, 4]], ["AN", 8, 0, 5], ["FU", 8, [1, 2, 3, 4, 5]], ["AN", 8, 1, 4], ["FU", 8, [2, 3, 4, 5, 6]], ["AN", 8, 2, 6], ["FU", 6, [0, 1, 2, 3, 4, 5]], ["SP", 6, 0, 144, [1], 1], ["AN", 6, 1, 2], ["FFSP", 6, 0, [12, 11, 10, 9, 8], 1, 1], ["AN", 6, 1, 6], ["FU", 3, [0, 1, 2, 3, 4]], ["SP", 3, 0, 144, [24], 1], ["AN", 3, 1, 2], ["FFSP", 3, 0, [12, 11, 10, 9, 8], 1, 1], ["AN", 3, 1, 6], ["PR", 7, 0, "auto_unroll_max_step$512"]]]], "r": [[0.000572671], 0, 8.26504, 1722425021], "v": "v0.6"}
{"i": [["[\"113370991bc27f5cd1de28d21f562292\", [1, 64, 56, 56], [128, 64, 3, 3], [1, 128, 28, 28]]", "cuda -keys=cuda,gpu -arch=sm_75 -max_num_threads=1024 -thread_warp_size=32", [-1, 16, 64, 49152, 2147483647, 1024, 8, 32], "", 0, []], [[], [["CI", 12], ["CI", 11], ["CI", 10], ["CI", 9], ["CI", 8], ["CI", 7], ["CI", 6], ["CHW", 5, "local"], ["SP", 5, 0, 1, [1, 1, 1, 1], 1], ["SP", 5, 5, 32, [1, 32, 1, 1], 1], ["SP", 5, 10, 28, [1, 7, 2, 1], 1], ["SP", 5, 15, 28, [1, 2, 1, 14], 1], ["SP", 5, 20, 4, [1, 1, 2, 1], 1], ["SP", 5, 25, 16, [4, 1], 1], ["SP", 5, 28, 3, [1, 1], 1], ["SP", 5, 31, 3, [1, 1], 1], ["SP", 5, 34, 4, [1, 4], 1], ["RE", 5, [0, 5, 10, 15, 20, 1, 6, 11, 16, 21, 2, 7, 12, 17, 22, 25, 28, 31, 34, 26, 29, 32, 35, 3, 8, 13, 18, 23, 27, 30, 33, 36, 4, 9, 14, 19, 24]], ["FSP", 6, 0, 8, 3], ["FSP", 6, 4, 9, 3], ["FSP", 6, 8, 10, 3], ["FSP", 6, 12, 11, 3], ["FSP", 6, 16, 12, 3], ["RE", 6, [0, 4, 8, 12, 16, 1, 5, 9, 13, 17, 2, 6, 10, 14, 18, 3, 7, 11, 15, 19]], ["CA", 5, 6, 14], ["CHR", 4, "shared", [5]], ["CA", 5, 6, 18], ["CI", 4], ["CHR", 2, "shared", [6]], ["CA", 3, 7, 18], ["CI", 2], ["CI", 1], ["FU", 16, [0, 1, 2, 3]], ["SP", 16, 0, 100352, [32], 1], ["AN", 16, 0, 5], ["AN", 16, 1, 6], ["FU", 8, [0, 1, 2, 3, 4]], ["AN", 8, 0, 5], ["FU", 8, [1, 2, 3, 4, 5]], ["AN", 8, 1, 4], ["FU", 8, [2, 3, 4, 5, 6]], ["AN", 8, 2, 6], ["FU", 6, [0, 1, 2, 3, 4, 5]], ["SP", 6, 0, 96, [1], 1], ["AN", 6, 1, 2], ["FFSP", 6, 0, [12, 11, 10, 9, 8], 1, 1], ["AN", 6, 1, 6], ["FU", 3, [0, 1, 2, 3, 4]], ["SP", 3, 0, 1392, [1], 1], ["AN", 3, 1, 2], ["FFSP", 3, 0, [12, 11, 10, 9, 8], 1, 1], ["AN", 3, 1, 6], ["PR", 7, 0, "auto_unroll_max_step$512"]]]], "r": [[0.000530121], 0, 5.48605, 1722425022], "v": "v0.6"}
{"i": [["[\"113370991bc27f5cd1de28d21f562292\", [1, 64, 56, 56], [128, 64, 3, 3], [1, 128, 28, 28]]", "cuda -keys=cuda,gpu -arch=sm_75 -max_num_threads=1024 -thread_warp_size=32", [-1, 16, 64, 49152, 2147483647, 1024, 8, 32], "", 0, []], [[], [["CI", 12], ["CI", 11], ["CI", 10], ["CI", 9], ["CI", 8], ["CI", 7], ["CI", 6], ["CHW", 5, "local"], ["SP", 5, 0, 1, [1, 1, 1, 1], 1], ["SP", 5, 5, 32, [2, 4, 2, 1], 1], ["SP", 5, 10, 28, [1, 7, 1, 1], 1], ["SP", 5, 15, 28, [1, 2, 2, 7], 1], ["SP", 5, 20, 4, [1, 1, 1, 4], 1], ["SP", 5, 25, 16, [1, 1], 1], ["SP", 5, 28, 3, [1, 3], 1], ["SP", 5, 31, 3, [1, 3], 1], ["SP", 5, 34, 4, [2, 1], 1], ["RE", 5, [0, 5, 10, 15, 20, 1, 6, 11, 16, 21, 2, 7, 12, 17, 22, 25, 28, 31, 34, 26, 29, 32, 35, 3, 8, 13, 18, 23, 27, 30, 33, 36, 4, 9, 14, 19, 24]], ["FSP", 6, 0, 8, 3], ["FSP", 6, 4, 9, 3], ["FSP", 6, 8, 10, 3], ["FSP", 6, 12, 11, 3], ["FSP", 6, 16, 12, 3], ["RE", 6, [0, 4, 8, 12, 16, 1, 5, 9, 13, 17, 2, 6, 10, 14, 18, 3, 7, 11, 15, 19]], ["CA", 5, 6, 14], ["CHR", 4, "shared", [5]], ["CA", 5, 6, 18], ["CI", 4], ["CHR", 2, "shared", [6]], ["CA", 3, 7, 18], ["CI", 2], ["CI", 1], ["FU", 16, [0, 1, 2, 3]], ["SP", 16, 0, 100352, [32], 1], ["AN", 16, 0, 5], ["AN", 16, 1, 6], ["FU", 8, [0, 1, 2, 3, 4]], ["AN", 8, 0, 5], ["FU", 8, [1, 2, 3, 4, 5]], ["AN", 8, 1, 4], ["FU", 8, [2, 3, 4, 5, 6]], ["AN", 8, 2, 6], ["FU", 6, [0, 1, 2, 3, 4, 5]], ["SP", 6, 0, 288, [1], 1], ["AN", 6, 1, 2], ["FFSP", 6, 0, [12, 11, 10, 9, 8], 1, 1], ["AN", 6, 1, 6], ["FU", 3, [0, 1, 2, 3, 4]], ["SP", 3, 0, 348, [1], 1], ["AN", 3, 1, 2], ["FFSP", 3, 0, [12, 11, 10, 9, 8], 1, 1], ["AN", 3, 1, 6], ["PR", 7, 0, "auto_unroll_max_step$0"]]]], "r": [[0.000316193], 0, 3.50036, 1722425023], "v": "v0.6"}
{"i": [["[\"113370991bc27f5cd1de28d21f562292\", [1, 64, 56, 56], [128, 64, 3, 3], [1, 128, 28, 28]]", "cuda -keys=cuda,gpu -arch=sm_75 -max_num_threads=1024 -thread_warp_size=32", [-1, 16, 64, 49152, 2147483647, 1024, 8, 32], "", 0, []], [[], [["CI", 12], ["CI", 11], ["CI", 10], ["CI", 9], ["CI", 8], ["CI", 7], ["CI", 6], ["CHW", 5, "local"], ["SP", 5, 0, 1, [1, 1, 1, 1], 1], ["SP", 5, 5, 32, [1, 16, 1, 1], 1], ["SP", 5, 10, 28, [1, 1, 1, 2], 1], ["SP", 5, 15, 28, [1, 7, 4, 1], 1], ["SP", 5, 20, 4, [1, 2, 1, 2], 1], ["SP", 5, 25, 16, [16, 1], 1], ["SP", 5, 28, 3, [1, 1], 1], ["SP", 5, 31, 3, [1, 1], 1], ["SP", 5, 34, 4, [1, 2], 1], ["RE", 5, [0, 5, 10, 15, 20, 1, 6, 11, 16, 21, 2, 7, 12, 17, 22, 25, 28, 31, 34, 26, 29, 32, 35, 3, 8, 13, 18, 23, 27, 30, 33, 36, 4, 9, 14, 19, 24]], ["FSP", 6, 0, 8, 3], ["FSP", 6, 4, 9, 3], ["FSP", 6, 8, 10, 3], ["FSP", 6, 12, 11, 3], ["FSP", 6, 16, 12, 3], ["RE", 6, [0, 4, 8, 12, 16, 1, 5, 9, 13, 17, 2, 6, 10, 14, 18, 3, 7, 11, 15, 19]], ["CA", 5, 6, 14], ["CHR", 4, "shared", [5]], ["CA", 5, 6, 18], ["CI", 4], ["CHR", 2, "shared", [6]], ["CA", 3, 7, 18], ["CI", 2], ["CI", 1], ["FU", 16, [0, 1, 2, 3]], ["SP", 16, 0, 100352, [32], 1], ["AN", 16, 0, 5], ["AN", 16, 1, 6], ["FU", 8, [0, 1, 2, 3, 4]], ["AN", 8, 0, 5], ["FU", 8, [1, 2, 3, 4, 5]], ["AN", 8, 1, 4], ["FU", 8, [2, 3, 4, 5, 6]], ["AN", 8, 2, 6], ["FU", 6, [0, 1, 2, 3, 4, 5]], ["SP", 6, 0, 64, [1], 1], ["AN", 6, 1, 2], ["FFSP", 6, 0, [12, 11, 10, 9, 8], 1, 1], ["AN", 6, 1, 6], ["FU", 3, [0, 1, 2, 3, 4]], ["SP", 3, 0, 672, [1], 1], ["AN", 3, 1, 2], ["FFSP", 3, 0, [12, 11, 10, 9, 8], 1, 1], ["AN", 3, 1, 6], ["PR", 7, 0, "auto_unroll_max_step$0"]]]], "r": [[0.000213512], 0, 2.03185, 1722425024], "v": "v0.6"}
{"i": [["[\"113370991bc27f5cd1de28d21f562292\", [1, 64, 56, 56], [128, 64, 3, 3], [1, 128, 28, 28]]", "cuda -keys=cuda,gpu -arch=sm_75 -max_num_threads=1024 -thread_warp_size=32", [-1, 16, 64, 49152, 2147483647, 1024, 8, 32], "", 0, []], [[], [["CI", 12], ["CI", 11], ["CI", 10], ["CI", 9], ["CI", 8], ["CI", 7], ["CI", 6], ["CHW", 5, "local"], ["SP", 5, 0, 1, [1, 1, 1, 1], 1], ["SP", 5, 5, 32, [1, 8, 1, 4], 1], ["SP", 5, 10, 28, [4, 1, 1, 1], 1], ["SP", 5, 15, 28, [1, 7, 1, 2], 1], ["SP", 5, 20, 4, [1, 1, 1, 2], 1], ["SP", 5, 25, 16, [2, 4], 1], ["SP", 5, 28, 3, [1, 3], 1], ["SP", 5, 31, 3, [3, 1], 1], ["SP", 5, 34, 4, [2, 2], 1], ["RE", 5, [0, 5, 10, 15, 20, 1, 6, 11, 16, 21, 2, 7, 12, 17, 22, 25, 28, 31, 34, 26, 29, 32, 35, 3, 8, 13, 18, 23, 27, 30, 33, 36, 4, 9, 14, 19, 24]], ["FSP", 6, 0, 8, 3], ["FSP", 6, 4, 9, 3], ["FSP", 6, 8, 10, 3], ["FSP", 6, 12, 11, 3], ["FSP", 6, 16, 12, 3], ["RE", 6, [0, 4, 8, 12, 16, 1, 5, 9, 13, 17, 2, 6, 10, 14, 18, 3, 7, 11, 15, 19]], ["CA", 5, 6, 14], ["CHR", 4, "shared", [5]], ["CA", 5, 6, 18], ["CI", 4], ["CHR", 2, "shared", [6]], ["CA", 3, 7, 18], ["CI", 2], ["CI", 1], ["FU", 16, [0, 1, 2, 3]], ["SP", 16, 0, 100352, [32], 1], ["AN", 16, 0, 5], ["AN", 16, 1, 6], ["FU", 8, [0, 1, 2, 3, 4]], ["AN", 8, 0, 5], ["FU", 8, [1, 2, 3, 4, 5]], ["AN", 8, 1, 4], ["FU", 8, [2, 3, 4, 5, 6]], ["AN", 8, 2, 6], ["FU", 6, [0, 1, 2, 3, 4, 5]], ["SP", 6, 0, 2304, [1], 1], ["AN", 6, 1, 2], ["FFSP", 6, 0, [12, 11, 10, 9, 8], 1, 1], ["AN", 6, 1, 6], ["FU", 3, [0, 1, 2, 3, 4]], ["SP", 3, 0, 480, [1], 1], ["AN", 3, 1, 2], ["FFSP", 3, 0, [12, 11, 10, 9, 8], 1, 1], ["AN", 3, 1, 6], ["PR", 7, 0, "auto_unroll_max_step$64"]]]], "r": [[0.000280317], 0, 3.5954, 1722425025], "v": "v0.6"}
{"i": [["[\"113370991bc27f5cd1de28d21f562292\", [1, 64, 56, 56], [128, 64, 3, 3], [1, 128, 28, 28]]", "cuda -keys=cuda,gpu -arch=sm_75 -max_num_threads=1024 -thread_warp_size=32", [-1, 16, 64, 49152, 2147483647, 1024, 8, 32], "", 0, []], [[], [["CI", 12], ["CI", 11], ["CI", 10], ["CI", 9], ["CI", 8], ["CI", 7], ["CI", 6], ["CHW", 5, "local"], ["SP", 5, 0, 1, [1, 1, 1, 1], 1], ["SP", 5, 5, 32, [2, 4, 1, 4], 1], ["SP", 5, 10, 28, [1, 7, 4, 1], 1], ["SP", 5, 15, 28, [1, 2, 2, 1], 1], ["SP", 5, 20, 4, [1, 1, 1, 4], 1], ["SP", 5, 25, 16, [1, 4], 1], ["SP", 5, 28, 3, [1, 3], 1], ["SP", 5, 31, 3, [1, 1], 1], ["SP", 5, 34, 4, [1, 4], 1], ["RE", 5, [0, 5, 10, 15, 20, 1, 6, 11, 16, 21, 2, 7, 12, 17, 22, 25, 28, 31, 34, 26, 29, 32, 35, 3, 8, 13, 18, 23, 27, 30, 33, 36, 4, 9, 14, 19, 24]], ["FSP", 6, 0, 8, 3], ["FSP", 6, 4, 9, 3], ["FSP", 6, 8, 10, 3], ["FSP", 6, 12, 11, 3], ["FSP", 6, 16, 12, 3], ["RE", 6, [0, 4, 8, 12, 16, 1, 5, 9, 13, 17, 2, 6, 10, 14, 18, 3, 7, 11, 15, 19]], ["CA", 5, 6, 14], ["CHR", 4, "shared", [5]], ["CA", 5, 6, 18], ["CI", 4], ["CHR", 2, "shared", [6]], ["CA", 3, 7, 18], ["CI", 2], ["CI", 1], ["FU", 16, [0, 1, 2, 3]], ["SP", 16, 0, 100352, [4], 1], ["AN", 16, 0, 5], ["AN", 16, 1, 6], ["FU", 8, [0, 1, 2, 3, 4]], ["AN", 8, 0, 5], ["FU", 8, [1, 2, 3, 4, 5]], ["AN", 8, 1, 4], ["FU", 8, [2, 3, 4, 5, 6]], ["AN", 8, 2, 6], ["FU", 6, [0, 1, 2, 3, 4, 5]], ["SP", 6, 0, 384, [1], 1], ["AN", 6, 1, 2], ["FFSP", 6, 0, [12, 11, 10, 9, 8], 1, 1], ["AN", 6, 1, 6], ["FU", 3, [0, 1, 2, 3, 4]], ["SP", 3, 0, 216, [1], 1], ["AN", 3, 1, 2], ["FFSP", 3, 0, [12, 11, 10, 9, 8], 1, 1], ["AN", 3, 1, 6], ["PR", 7, 0, "auto_unroll_max_step$16"]]]], "r": [[0.000886164], 0, 3.74089, 1722425025], "v": "v0.6"}
{"i": [["[\"113370991bc27f5cd1de28d21f562292\", [1, 64, 56, 56], [128, 64, 3, 3], [1, 128, 28, 28]]", "cuda -keys=cuda,gpu -arch=sm_75 -max_num_threads=1024 -thread_warp_size=32", [-1, 16, 64, 49152, 2147483647, 1024, 8, 32], "", 0, []], [[], [["CI", 12], ["CI", 11], ["CI", 10], ["CI", 9], ["CI", 8], ["CI", 7], ["CI", 6], ["CHW", 5, "local"], ["SP", 5, 0, 1, [1, 1, 1, 1], 1], ["SP", 5, 5, 32, [1, 4, 2, 1], 1], ["SP", 5, 10, 28, [1, 2, 1, 2], 1], ["SP", 5, 15, 28, [1, 7, 2, 1], 1], ["SP", 5, 20, 4, [1, 1, 1, 2], 1], ["SP", 5, 25, 16, [1, 8], 1], ["SP", 5, 28, 3, [3, 1], 1], ["SP", 5, 31, 3, [1, 1], 1], ["SP", 5, 34, 4, [4, 1], 1], ["RE", 5, [0, 5, 10, 15, 20, 1, 6, 11, 16, 21, 2, 7, 12, 17, 22, 25, 28, 31, 34, 26, 29, 32, 35, 3, 8, 13, 18, 23, 27, 30, 33, 36, 4, 9, 14, 19, 24]], ["FSP", 6, 0, 8, 3], ["FSP", 6, 4, 9, 3], ["FSP", 6, 8, 10, 3], ["FSP", 6, 12, 11, 3], ["FSP", 6, 16, 12, 3], ["RE", 6, [0, 4, 8, 12, 16, 1, 5, 9, 13, 17, 2, 6, 10, 14, 18, 3, 7, 11, 15, 19]], ["CA", 5, 6, 14], ["CHR", 4, "shared", [5]], ["CA", 5, 6, 18], ["CI", 4], ["CHR", 2, "shared", [6]], ["CA", 3, 7, 18], ["CI", 2], ["CI", 1], ["FU", 16, [0, 1, 2, 3]], ["SP", 16, 0, 100352, [32], 1], ["AN", 16, 0, 5], ["AN", 16, 1, 6], ["FU", 8, [0, 1, 2, 3, 4]], ["AN", 8, 0, 5], ["FU", 8, [1, 2, 3, 4, 5]], ["AN", 8, 1, 4], ["FU", 8, [2, 3, 4, 5, 6]], ["AN", 8, 2, 6], ["FU", 6, [0, 1, 2, 3, 4, 5]], ["SP", 6, 0, 1152, [1], 1], ["AN", 6, 1, 2], ["FFSP", 6, 0, [12, 11, 10, 9, 8], 1, 1], ["AN", 6, 1, 6], ["FU", 3, [0, 1, 2, 3, 4]], ["SP", 3, 0, 800, [1], 1], ["AN", 3, 1, 2], ["FFSP", 3, 0, [12, 11, 10, 9, 8], 1, 1], ["AN", 3, 1, 6], ["PR", 7, 0, "auto_unroll_max_step$64"]]]], "r": [[0.000382316], 0, 3.2164, 1722425026], "v": "v0.6"}
{"i": [["[\"113370991bc27f5cd1de28d21f562292\", [1, 64, 56, 56], [128, 64, 3, 3], [1, 128, 28, 28]]", "cuda -keys=cuda,gpu -arch=sm_75 -max_num_threads=1024 -thread_warp_size=32", [-1, 16, 64, 49152, 2147483647, 1024, 8, 32], "", 0, []], [[], [["CI", 12], ["CI", 11], ["CI", 10], ["CI", 9], ["CI", 8], ["CI", 7], ["CI", 6], ["CHW", 5, "local"], ["SP", 5, 0, 1, [1, 1, 1, 1], 1], ["SP", 5, 5, 32, [2, 2, 2, 4], 1], ["SP", 5, 10, 28, [1, 14, 1, 2], 1], ["SP", 5, 15, 28, [2, 1, 1, 1], 1], ["SP", 5, 20, 4, [1, 2, 1, 2], 1], ["SP", 5, 25, 16, [2, 8], 1], ["SP", 5, 28, 3, [3, 1], 1], ["SP", 5, 31, 3, [1, 1], 1], ["SP", 5, 34, 4, [2, 1], 1], ["RE", 5, [0, 5, 10, 15, 20, 1, 6, 11, 16, 21, 2, 7, 12, 17, 22, 25, 28, 31, 34, 26, 29, 32, 35, 3, 8, 13, 18, 23, 27, 30, 33, 36, 4, 9, 14, 19, 24]], ["FSP", 6, 0, 8, 3], ["FSP", 6, 4, 9, 3], ["FSP", 6, 8, 10, 3], ["FSP", 6, 12, 11, 3], ["FSP", 6, 16, 12, 3], ["RE", 6, [0, 4, 8, 12, 16, 1, 5, 9, 13, 17, 2, 6, 10, 14, 18, 3, 7, 11, 15, 19]], ["CA", 5, 6, 14], ["CHR", 4, "shared", [5]], ["CA", 5, 6, 18], ["CI", 4], ["CHR", 2, "shared", [6]], ["CA", 3, 7, 18], ["CI", 2], ["CI", 1], ["FU", 16, [0, 1, 2, 3]], ["SP", 16, 0, 100352, [32], 1], ["AN", 16, 0, 5], ["AN", 16, 1, 6], ["FU", 8, [0, 1, 2, 3, 4]], ["AN", 8, 0, 5], ["FU", 8, [1, 2, 3, 4, 5]], ["AN", 8, 1, 4], ["FU", 8, [2, 3, 4, 5, 6]], ["AN", 8, 2, 6], ["FU", 6, [0, 1, 2, 3, 4, 5]], ["SP", 6, 0, 768, [1], 1], ["AN", 6, 1, 2], ["FFSP", 6, 0, [12, 11, 10, 9, 8], 1, 1], ["AN", 6, 1, 6], ["FU", 3, [0, 1, 2, 3, 4]], ["SP", 3, 0, 80, [1], 1], ["AN", 3, 1, 2], ["FFSP", 3, 0, [12, 11, 10, 9, 8], 1, 1], ["AN", 3, 1, 6], ["PR", 7, 0, "auto_unroll_max_step$16"]]]], "r": [[0.000340236], 0, 2.85871, 1722425027], "v": "v0.6"}
{"i": [["[\"113370991bc27f5cd1de28d21f562292\", [1, 64, 56, 56], [128, 64, 3, 3], [1, 128, 28, 28]]", "cuda -keys=cuda,gpu -arch=sm_75 -max_num_threads=1024 -thread_warp_size=32", [-1, 16, 64, 49152, 2147483647, 1024, 8, 32], "", 0, []], [[], [["CI", 12], ["CI", 11], ["CI", 10], ["CI", 9], ["CI", 8], ["CI", 7], ["CI", 6], ["CHW", 5, "local"], ["SP", 5, 0, 1, [1, 1, 1, 1], 1], ["SP", 5, 5, 32, [2, 2, 4, 1], 1], ["SP", 5, 10, 28, [1, 28, 1, 1], 1], ["SP", 5, 15, 28, [1, 1, 4, 1], 1], ["SP", 5, 20, 4, [1, 2, 2, 1], 1], ["SP", 5, 25, 16, [4, 1], 1], ["SP", 5, 28, 3, [3, 1], 1], ["SP", 5, 31, 3, [1, 3], 1], ["SP", 5, 34, 4, [2, 2], 1], ["RE", 5, [0, 5, 10, 15, 20, 1, 6, 11, 16, 21, 2, 7, 12, 17, 22, 25, 28, 31, 34, 26, 29, 32, 35, 3, 8, 13, 18, 23, 27, 30, 33, 36, 4, 9, 14, 19, 24]], ["FSP", 6, 0, 8, 3], ["FSP", 6, 4, 9, 3], ["FSP", 6, 8, 10, 3], ["FSP", 6, 12, 11, 3], ["FSP", 6, 16, 12, 3], ["RE", 6, [0, 4, 8, 12, 16, 1, 5, 9, 13, 17, 2, 6, 10, 14, 18, 3, 7, 11, 15, 19]], ["CA", 5, 6, 14], ["CHR", 4, "shared", [5]], ["CA", 5, 6, 18], ["CI", 4], ["CHR", 2, "shared", [6]], ["CA", 3, 7, 18], ["CI", 2], ["CI", 1], ["FU", 16, [0, 1, 2, 3]], ["SP", 16, 0, 100352, [32], 1], ["AN", 16, 0, 5], ["AN", 16, 1, 6], ["FU", 8, [0, 1, 2, 3, 4]], ["AN", 8, 0, 5], ["FU", 8, [1, 2, 3, 4, 5]], ["AN", 8, 1, 4], ["FU", 8, [2, 3, 4, 5, 6]], ["AN", 8, 2, 6], ["FU", 6, [0, 1, 2, 3, 4, 5]], ["SP", 6, 0, 576, [1], 1], ["AN", 6, 1, 2], ["FFSP", 6, 0, [12, 11, 10, 9, 8], 1, 1], ["AN", 6, 1, 6], ["FU", 3, [0, 1, 2, 3, 4]], ["SP", 3, 0, 216, [1], 1], ["AN", 3, 1, 2], ["FFSP", 3, 0, [12, 11, 10, 9, 8], 1, 1], ["AN", 3, 1, 6], ["PR", 7, 0, "auto_unroll_max_step$64"]]]], "r": [[0.000182163], 0, 3.19956, 1722425028], "v": "v0.6"}
{"i": [["[\"113370991bc27f5cd1de28d21f562292\", [1, 64, 56, 56], [128, 64, 3, 3], [1, 128, 28, 28]]", "cuda -keys=cuda,gpu -arch=sm_75 -max_num_threads=1024 -thread_warp_size=32", [-1, 16, 64, 49152, 2147483647, 1024, 8, 32], "", 0, []], [[], [["CI", 12], ["CI", 11], ["CI", 10], ["CI", 9], ["CI", 8], ["CI", 7], ["CI", 6], ["CHW", 5, "local"], ["SP", 5, 0, 1, [1, 1, 1, 1], 1], ["SP", 5, 5, 32, [1, 32, 1, 1], 1], ["SP", 5, 10, 28, [4, 1, 1, 7], 1], ["SP", 5, 15, 28, [1, 1, 1, 2], 1], ["SP", 5, 20, 4, [1, 2, 1, 2], 1], ["SP", 5, 25, 16, [2, 1], 1], ["SP", 5, 28, 3, [1, 3], 1], ["SP", 5, 31, 3, [1, 1], 1], ["SP", 5, 34, 4, [2, 1], 1], ["RE", 5, [0, 5, 10, 15, 20, 1, 6, 11, 16, 21, 2, 7, 12, 17, 22, 25, 28, 31, 34, 26, 29, 32, 35, 3, 8, 13, 18, 23, 27, 30, 33, 36, 4, 9, 14, 19, 24]], ["FSP", 6, 0, 8, 3], ["FSP", 6, 4, 9, 3], ["FSP", 6, 8, 10, 3], ["FSP", 6, 12, 11, 3], ["FSP", 6, 16, 12, 3], ["RE", 6, [0, 4, 8, 12, 16, 1, 5, 9, 13, 17, 2, 6, 10, 14, 18, 3, 7, 11, 15, 19]], ["CA", 5, 6, 14], ["CHR", 4, "shared", [5]], ["CA", 5, 6, 18], ["CI", 4], ["CHR", 2, "shared", [6]], ["CA", 3, 7, 18], ["CI", 2], ["CI", 1], ["FU", 16, [0, 1, 2, 3]], ["SP", 16, 0, 100352, [32], 1], ["AN", 16, 0, 5], ["AN", 16, 1, 6], ["FU", 8, [0, 1, 2, 3, 4]], ["AN", 8, 0, 5], ["FU", 8, [1, 2, 3, 4, 5]], ["AN", 8, 1, 4], ["FU", 8, [2, 3, 4, 5, 6]], ["AN", 8, 2, 6], ["FU", 6, [0, 1, 2, 3, 4, 5]], ["SP", 6, 0, 72, [36], 1], ["AN", 6, 1, 2], ["FFSP", 6, 0, [12, 11, 10, 9, 8], 1, 1], ["AN", 6, 1, 6], ["FU", 3, [0, 1, 2, 3, 4]], ["SP", 3, 0, 180, [1], 1], ["AN", 3, 1, 2], ["FFSP", 3, 0, [12, 11, 10, 9, 8], 1, 1], ["AN", 3, 1, 6], ["PR", 7, 0, "auto_unroll_max_step$64"]]]], "r": [[0.000291594], 0, 3.53185, 1722425029], "v": "v0.6"}
{"i": [["[\"113370991bc27f5cd1de28d21f562292\", [1, 64, 56, 56], [128, 64, 3, 3], [1, 128, 28, 28]]", "cuda -keys=cuda,gpu -arch=sm_75 -max_num_threads=1024 -thread_warp_size=32", [-1, 16, 64, 49152, 2147483647, 1024, 8, 32], "", 0, []], [[], [["CI", 12], ["CI", 11], ["CI", 10], ["CI", 9], ["CI", 8], ["CI", 7], ["CI", 6], ["CHW", 5, "local"], ["SP", 5, 0, 1, [1, 1, 1, 1], 1], ["SP", 5, 5, 32, [8, 2, 1, 2], 1], ["SP", 5, 10, 28, [1, 7, 2, 2], 1], ["SP", 5, 15, 28, [1, 1, 4, 1], 1], ["SP", 5, 20, 4, [1, 1, 2, 2], 1], ["SP", 5, 25, 16, [1, 4], 1], ["SP", 5, 28, 3, [1, 1], 1], ["SP", 5, 31, 3, [1, 3], 1], ["SP", 5, 34, 4, [1, 2], 1], ["RE", 5, [0, 5, 10, 15, 20, 1, 6, 11, 16, 21, 2, 7, 12, 17, 22, 25, 28, 31, 34, 26, 29, 32, 35, 3, 8, 13, 18, 23, 27, 30, 33, 36, 4, 9, 14, 19, 24]], ["FSP", 6, 0, 8, 3], ["FSP", 6, 4, 9, 3], ["FSP", 6, 8, 10, 3], ["FSP", 6, 12, 11, 3], ["FSP", 6, 16, 12, 3], ["RE", 6, [0, 4, 8, 12, 16, 1, 5, 9, 13, 17, 2, 6, 10, 14, 18, 3, 7, 11, 15, 19]], ["CA", 5, 6, 14], ["CHR", 4, "shared", [5]], ["CA", 5, 6, 18], ["CI", 4], ["CHR", 2, "shared", [6]], ["CA", 3, 7, 18], ["CI", 2], ["CI", 1], ["FU", 16, [0, 1, 2, 3]], ["SP", 16, 0, 100352, [32], 1], ["AN", 16, 0, 5], ["AN", 16, 1, 6], ["FU", 8, [0, 1, 2, 3, 4]], ["AN", 8, 0, 5], ["FU", 8, [1, 2, 3, 4, 5]], ["AN", 8, 1, 4], ["FU", 8, [2, 3, 4, 5, 6]], ["AN", 8, 2, 6], ["FU", 6, [0, 1, 2, 3, 4, 5]], ["SP", 6, 0, 192, [1], 1], ["AN", 6, 1, 2], ["FFSP", 6, 0, [12, 11, 10, 9, 8], 1, 1], ["AN", 6, 1, 6], ["FU", 3, [0, 1, 2, 3, 4]], ["SP", 3, 0, 120, [60], 1], ["AN", 3, 1, 2], ["FFSP", 3, 0, [12, 11, 10, 9, 8], 1, 1], ["AN", 3, 1, 6], ["PR", 7, 0, "auto_unroll_max_step$0"]]]], "r": [[0.00252609], 0, 4.84402, 1722425030], "v": "v0.6"}
{"i": [["[\"113370991bc27f5cd1de28d21f562292\", [1, 64, 56, 56], [128, 64, 3, 3], [1, 128, 28, 28]]", "cuda -keys=cuda,gpu -arch=sm_75 -max_num_threads=1024 -thread_warp_size=32", [-1, 16, 64, 49152, 2147483647, 1024, 8, 32], "", 0, []], [[], [["CI", 12], ["CI", 11], ["CI", 10], ["CI", 9], ["CI", 8], ["CI", 7], ["CI", 6], ["CHW", 5, "local"], ["SP", 5, 0, 1, [1, 1, 1, 1], 1], ["SP", 5, 5, 32, [1, 2, 1, 1], 1], ["SP", 5, 10, 28, [4, 1, 1, 1], 1], ["SP", 5, 15, 28, [2, 1, 1, 7], 1], ["SP", 5, 20, 4, [1, 1, 2, 2], 1], ["SP", 5, 25, 16, [4, 4], 1], ["SP", 5, 28, 3, [1, 3], 1], ["SP", 5, 31, 3, [1, 3], 1], ["SP", 5, 34, 4, [1, 1], 1], ["RE", 5, [0, 5, 10, 15, 20, 1, 6, 11, 16, 21, 2, 7, 12, 17, 22, 25, 28, 31, 34, 26, 29, 32, 35, 3, 8, 13, 18, 23, 27, 30, 33, 36, 4, 9, 14, 19, 24]], ["FSP", 6, 0, 8, 3], ["FSP", 6, 4, 9, 3], ["FSP", 6, 8, 10, 3], ["FSP", 6, 12, 11, 3], ["FSP", 6, 16, 12, 3], ["RE", 6, [0, 4, 8, 12, 16, 1, 5, 9, 13, 17, 2, 6, 10, 14, 18, 3, 7, 11, 15, 19]], ["CA", 5, 6, 14], ["CHR", 4, "shared", [5]], ["CA", 5, 6, 18], ["CI", 4], ["CHR", 2, "shared", [6]], ["CA", 3, 7, 18], ["CI", 2], ["CI", 1], ["FU", 16, [0, 1, 2, 3]], ["SP", 16, 0, 100352, [32], 1], ["AN", 16, 0, 5], ["AN", 16, 1, 6], ["FU", 8, [0, 1, 2, 3, 4]], ["AN", 8, 0, 5], ["FU", 8, [1, 2, 3, 4, 5]], ["AN", 8, 1, 4], ["FU", 8, [2, 3, 4, 5, 6]], ["AN", 8, 2, 6], ["FU", 6, [0, 1, 2, 3, 4, 5]], ["SP", 6, 0, 576, [1], 1], ["AN", 6, 1, 2], ["FFSP", 6, 0, [12, 11, 10, 9, 8], 1, 1], ["AN", 6, 1, 6], ["FU", 3, [0, 1, 2, 3, 4]], ["SP", 3, 0, 720, [1], 1], ["AN", 3, 1, 2], ["FFSP", 3, 0, [12, 11, 10, 9, 8], 1, 1], ["AN", 3, 1, 6], ["PR", 7, 0, "auto_unroll_max_step$0"]]]], "r": [[0.00562109], 0, 3.63571, 1722425031], "v": "v0.6"}
{"i": [["[\"113370991bc27f5cd1de28d21f562292\", [1, 64, 56, 56], [128, 64, 3, 3], [1, 128, 28, 28]]", "cuda -keys=cuda,gpu -arch=sm_75 -max_num_threads=1024 -thread_warp_size=32", [-1, 16, 64, 49152, 2147483647, 1024, 8, 32], "", 0, []], [[], [["CI", 12], ["CI", 11], ["CI", 10], ["CI", 9], ["CI", 8], ["CI", 7], ["CI", 6], ["CHW", 5, "local"], ["SP", 5, 0, 1, [1, 1, 1, 1], 1], ["SP", 5, 5, 32, [1, 32, 1, 1], 1], ["SP", 5, 10, 28, [4, 1, 1, 7], 1], ["SP", 5, 15, 28, [2, 1, 1, 7], 1], ["SP", 5, 20, 4, [1, 1, 2, 2], 1], ["SP", 5, 25, 16, [1, 16], 1], ["SP", 5, 28, 3, [1, 3], 1], ["SP", 5, 31, 3, [3, 1], 1], ["SP", 5, 34, 4, [1, 1], 1], ["RE", 5, [0, 5, 10, 15, 20, 1, 6, 11, 16, 21, 2, 7, 12, 17, 22, 25, 28, 31, 34, 26, 29, 32, 35, 3, 8, 13, 18, 23, 27, 30, 33, 36, 4, 9, 14, 19, 24]], ["FSP", 6, 0, 8, 3], ["FSP", 6, 4, 9, 3], ["FSP", 6, 8, 10, 3], ["FSP", 6, 12, 11, 3], ["FSP", 6, 16, 12, 3], ["RE", 6, [0, 4, 8, 12, 16, 1, 5, 9, 13, 17, 2, 6, 10, 14, 18, 3, 7, 11, 15, 19]], ["CA", 5, 6, 14], ["CHR", 4, "shared", [5]], ["CA", 5, 6, 18], ["CI", 4], ["CHR", 2, "shared", [6]], ["CA", 3, 7, 18], ["CI", 2], ["CI", 1], ["FU", 16, [0, 1, 2, 3]], ["SP", 16, 0, 100352, [32], 1], ["AN", 16, 0, 5], ["AN", 16, 1, 6], ["FU", 8, [0, 1, 2, 3, 4]], ["AN", 8, 0, 5], ["FU", 8, [1, 2, 3, 4, 5]], ["AN", 8, 1, 4], ["FU", 8, [2, 3, 4, 5, 6]], ["AN", 8, 2, 6], ["FU", 6, [0, 1, 2, 3, 4, 5]], ["SP", 6, 0, 576, [1], 1], ["AN", 6, 1, 2], ["FFSP", 6, 0, [12, 11, 10, 9, 8], 1, 1], ["AN", 6, 1, 6], ["FU", 3, [0, 1, 2, 3, 4]], ["SP", 3, 0, 720, [1], 1], ["AN", 3, 1, 2], ["FFSP", 3, 0, [12, 11, 10, 9, 8], 1, 1], ["AN", 3, 1, 6], ["PR", 7, 0, "auto_unroll_max_step$0"]]]], "r": [[0.00569126], 0, 5.00998, 1722425031], "v": "v0.6"}
{"i": [["[\"113370991bc27f5cd1de28d21f562292\", [1, 64, 56, 56], [128, 64, 3, 3], [1, 128, 28, 28]]", "cuda -keys=cuda,gpu -arch=sm_75 -max_num_threads=1024 -thread_warp_size=32", [-1, 16, 64, 49152, 2147483647, 1024, 8, 32], "", 0, []], [[], [["CI", 12], ["CI", 11], ["CI", 10], ["CI", 9], ["CI", 8], ["CI", 7], ["CI", 6], ["CHW", 5, "local"], ["SP", 5, 0, 1, [1, 1, 1, 1], 1], ["SP", 5, 5, 32, [1, 4, 8, 1], 1], ["SP", 5, 10, 28, [1, 7, 1, 1], 1], ["SP", 5, 15, 28, [2, 1, 7, 1], 1], ["SP", 5, 20, 4, [1, 2, 2, 1], 1], ["SP", 5, 25, 16, [1, 1], 1], ["SP", 5, 28, 3, [1, 3], 1], ["SP", 5, 31, 3, [1, 1], 1], ["SP", 5, 34, 4, [1, 1], 1], ["RE", 5, [0, 5, 10, 15, 20, 1, 6, 11, 16, 21, 2, 7, 12, 17, 22, 25, 28, 31, 34, 26, 29, 32, 35, 3, 8, 13, 18, 23, 27, 30, 33, 36, 4, 9, 14, 19, 24]], ["FSP", 6, 0, 8, 3], ["FSP", 6, 4, 9, 3], ["FSP", 6, 8, 10, 3], ["FSP", 6, 12, 11, 3], ["FSP", 6, 16, 12, 3], ["RE", 6, [0, 4, 8, 12, 16, 1, 5, 9, 13, 17, 2, 6, 10, 14, 18, 3, 7, 11, 15, 19]], ["CA", 5, 6, 14], ["CHR", 4, "shared", [5]], ["CA", 5, 6, 18], ["CI", 4], ["CHR", 2, "shared", [6]], ["CA", 3, 7, 18], ["CI", 2], ["CI", 1], ["FU", 16, [0, 1, 2, 3]], ["SP", 16, 0, 100352, [32], 1], ["AN", 16, 0, 5], ["AN", 16, 1, 6], ["FU", 8, [0, 1, 2, 3, 4]], ["AN", 8, 0, 5], ["FU", 8, [1, 2, 3, 4, 5]], ["AN", 8, 1, 4], ["FU", 8, [2, 3, 4, 5, 6]], ["AN", 8, 2, 6], ["FU", 6, [0, 1, 2, 3, 4, 5]], ["SP", 6, 0, 16, [1], 1], ["AN", 6, 1, 2], ["FFSP", 6, 0, [12, 11, 10, 9, 8], 1, 1], ["AN", 6, 1, 6], ["FU", 3, [0, 1, 2, 3, 4]], ["SP", 3, 0, 13, [1], 1], ["AN", 3, 1, 2], ["FFSP", 3, 0, [12, 11, 10, 9, 8], 1, 1], ["AN", 3, 1, 6], ["PR", 7, 0, "auto_unroll_max_step$512"]]]], "r": [[0.00135674], 0, 6.29243, 1722425055], "v": "v0.6"}
{"i": [["[\"113370991bc27f5cd1de28d21f562292\", [1, 64, 56, 56], [128, 64, 3, 3], [1, 128, 28, 28]]", "cuda -keys=cuda,gpu -arch=sm_75 -max_num_threads=1024 -thread_warp_size=32", [-1, 16, 64, 49152, 2147483647, 1024, 8, 32], "", 0, []], [[], [["CI", 12], ["CI", 11], ["CI", 10], ["CI", 9], ["CI", 8], ["CI", 7], ["CI", 6], ["CHW", 5, "local"], ["SP", 5, 0, 1, [1, 1, 1, 1], 1], ["SP", 5, 5, 32, [1, 8, 1, 1], 1], ["SP", 5, 10, 28, [2, 7, 2, 1], 1], ["SP", 5, 15, 28, [2, 2, 1, 1], 1], ["SP", 5, 20, 4, [1, 4, 1, 1], 1], ["SP", 5, 25, 16, [16, 1], 1], ["SP", 5, 28, 3, [3, 1], 1], ["SP", 5, 31, 3, [1, 1], 1], ["SP", 5, 34, 4, [1, 4], 1], ["RE", 5, [0, 5, 10, 15, 20, 1, 6, 11, 16, 21, 2, 7, 12, 17, 22, 25, 28, 31, 34, 26, 29, 32, 35, 3, 8, 13, 18, 23, 27, 30, 33, 36, 4, 9, 14, 19, 24]], ["FSP", 6, 0, 8, 3], ["FSP", 6, 4, 9, 3], ["FSP", 6, 8, 10, 3], ["FSP", 6, 12, 11, 3], ["FSP", 6, 16, 12, 3], ["RE", 6, [0, 4, 8, 12, 16, 1, 5, 9, 13, 17, 2, 6, 10, 14, 18, 3, 7, 11, 15, 19]], ["CA", 5, 6, 14], ["CHR", 4, "shared", [5]], ["CA", 5, 6, 18], ["CI", 4], ["CHR", 2, "shared", [6]], ["CA", 3, 7, 18], ["CI", 2], ["CI", 1], ["FU", 16, [0, 1, 2, 3]], ["SP", 16, 0, 100352, [32], 1], ["AN", 16, 0, 5], ["AN", 16, 1, 6], ["FU", 8, [0, 1, 2, 3, 4]], ["AN", 8, 0, 5], ["FU", 8, [1, 2, 3, 4, 5]], ["AN", 8, 1, 4], ["FU", 8, [2, 3, 4, 5, 6]], ["AN", 8, 2, 6], ["FU", 6, [0, 1, 2, 3, 4, 5]], ["SP", 6, 0, 384, [1], 1], ["AN", 6, 1, 2], ["FFSP", 6, 0, [12, 11, 10, 9, 8], 1, 1], ["AN", 6, 1, 6], ["FU", 3, [0, 1, 2, 3, 4]], ["SP", 3, 0, 320, [1], 1], ["AN", 3, 1, 2], ["FFSP", 3, 0, [12, 11, 10, 9, 8], 1, 1], ["AN", 3, 1, 6], ["PR", 7, 0, "auto_unroll_max_step$16"]]]], "r": [[0.000191836], 0, 2.82435, 1722425055], "v": "v0.6"}
{"i": [["[\"113370991bc27f5cd1de28d21f562292\", [1, 64, 56, 56], [128, 64, 3, 3], [1, 128, 28, 28]]", "cuda -keys=cuda,gpu -arch=sm_75 -max_num_threads=1024 -thread_warp_size=32", [-1, 16, 64, 49152, 2147483647, 1024, 8, 32], "", 0, []], [[], [["CI", 12], ["CI", 11], ["CI", 10], ["CI", 9], ["CI", 8], ["CI", 7], ["CI", 6], ["CHW", 5, "local"], ["SP", 5, 0, 1, [1, 1, 1, 1], 1], ["SP", 5, 5, 32, [1, 2, 1, 2], 1], ["SP", 5, 10, 28, [7, 1, 1, 2], 1], ["SP", 5, 15, 28, [1, 14, 1, 1], 1], ["SP", 5, 20, 4, [1, 4, 1, 1], 1], ["SP", 5, 25, 16, [4, 2], 1], ["SP", 5, 28, 3, [3, 1], 1], ["SP", 5, 31, 3, [1, 1], 1], ["SP", 5, 34, 4, [1, 2], 1], ["RE", 5, [0, 5, 10, 15, 20, 1, 6, 11, 16, 21, 2, 7, 12, 17, 22, 25, 28, 31, 34, 26, 29, 32, 35, 3, 8, 13, 18, 23, 27, 30, 33, 36, 4, 9, 14, 19, 24]], ["FSP", 6, 0, 8, 3], ["FSP", 6, 4, 9, 3], ["FSP", 6, 8, 10, 3], ["FSP", 6, 12, 11, 3], ["FSP", 6, 16, 12, 3], ["RE", 6, [0, 4, 8, 12, 16, 1, 5, 9, 13, 17, 2, 6, 10, 14, 18, 3, 7, 11, 15, 19]], ["CA", 5, 6, 14], ["CHR", 4, "shared", [5]], ["CA", 5, 6, 18], ["CI", 4], ["CHR", 2, "shared", [6]], ["CA", 3, 7, 18], ["CI", 2], ["CI", 1], ["FU", 16, [0, 1, 2, 3]], ["SP", 16, 0, 100352, [32], 1], ["AN", 16, 0, 5], ["AN", 16, 1, 6], ["FU", 8, [0, 1, 2, 3, 4]], ["AN", 8, 0, 5], ["FU", 8, [1, 2, 3, 4, 5]], ["AN", 8, 1, 4], ["FU", 8, [2, 3, 4, 5, 6]], ["AN", 8, 2, 6], ["FU", 6, [0, 1, 2, 3, 4, 5]], ["SP", 6, 0, 16, [1], 1], ["AN", 6, 1, 2], ["FFSP", 6, 0, [12, 11, 10, 9, 8], 1, 1], ["AN", 6, 1, 6], ["FU", 3, [0, 1, 2, 3, 4]], ["SP", 3, 0, 24, [1], 1], ["AN", 3, 1, 2], ["FFSP", 3, 0, [12, 11, 10, 9, 8], 1, 1], ["AN", 3, 1, 6], ["PR", 7, 0, "auto_unroll_max_step$512"]]]], "r": [[0.000164765], 0, 14.7771, 1722425056], "v": "v0.6"}
{"i": [["[\"113370991bc27f5cd1de28d21f562292\", [1, 64, 56, 56], [128, 64, 3, 3], [1, 128, 28, 28]]", "cuda -keys=cuda,gpu -arch=sm_75 -max_num_threads=1024 -thread_warp_size=32", [-1, 16, 64, 49152, 2147483647, 1024, 8, 32], "", 0, []], [[], [["CI", 12], ["CI", 11], ["CI", 10], ["CI", 9], ["CI", 8], ["CI", 7], ["CI", 6], ["CHW", 5, "local"], ["SP", 5, 0, 1, [1, 1, 1, 1], 1], ["SP", 5, 5, 32, [1, 4, 1, 4], 1], ["SP", 5, 10, 28, [1, 14, 2, 1], 1], ["SP", 5, 15, 28, [4, 1, 1, 1], 1], ["SP", 5, 20, 4, [1, 1, 2, 2], 1], ["SP", 5, 25, 16, [2, 2], 1], ["SP", 5, 28, 3, [3, 1], 1], ["SP", 5, 31, 3, [1, 3], 1], ["SP", 5, 34, 4, [4, 1], 1], ["RE", 5, [0, 5, 10, 15, 20, 1, 6, 11, 16, 21, 2, 7, 12, 17, 22, 25, 28, 31, 34, 26, 29, 32, 35, 3, 8, 13, 18, 23, 27, 30, 33, 36, 4, 9, 14, 19, 24]], ["FSP", 6, 0, 8, 3], ["FSP", 6, 4, 9, 3], ["FSP", 6, 8, 10, 3], ["FSP", 6, 12, 11, 3], ["FSP", 6, 16, 12, 3], ["RE", 6, [0, 4, 8, 12, 16, 1, 5, 9, 13, 17, 2, 6, 10, 14, 18, 3, 7, 11, 15, 19]], ["CA", 5, 6, 14], ["CHR", 4, "shared", [5]], ["CA", 5, 6, 18], ["CI", 4], ["CHR", 2, "shared", [6]], ["CA", 3, 7, 18], ["CI", 2], ["CI", 1], ["FU", 16, [0, 1, 2, 3]], ["SP", 16, 0, 100352, [32], 1], ["AN", 16, 0, 5], ["AN", 16, 1, 6], ["FU", 8, [0, 1, 2, 3, 4]], ["AN", 8, 0, 5], ["FU", 8, [1, 2, 3, 4, 5]], ["AN", 8, 1, 4], ["FU", 8, [2, 3, 4, 5, 6]], ["AN", 8, 2, 6], ["FU", 6, [0, 1, 2, 3, 4, 5]], ["SP", 6, 0, 2304, [1], 1], ["AN", 6, 1, 2], ["FFSP", 6, 0, [12, 11, 10, 9, 8], 1, 1], ["AN", 6, 1, 6], ["FU", 3, [0, 1, 2, 3, 4]], ["SP", 3, 0, 240, [1], 1], ["AN", 3, 1, 2], ["FFSP", 3, 0, [12, 11, 10, 9, 8], 1, 1], ["AN", 3, 1, 6], ["PR", 7, 0, "auto_unroll_max_step$64"]]]], "r": [[0.000254613], 0, 5.11818, 1722425057], "v": "v0.6"}
{"i": [["[\"113370991bc27f5cd1de28d21f562292\", [1, 64, 56, 56], [128, 64, 3, 3], [1, 128, 28, 28]]", "cuda -keys=cuda,gpu -arch=sm_75 -max_num_threads=1024 -thread_warp_size=32", [-1, 16, 64, 49152, 2147483647, 1024, 8, 32], "", 0, []], [[], [["CI", 12], ["CI", 11], ["CI", 10], ["CI", 9], ["CI", 8], ["CI", 7], ["CI", 6], ["CHW", 5, "local"], ["SP", 5, 0, 1, [1, 1, 1, 1], 1], ["SP", 5, 5, 32, [1, 8, 4, 1], 1], ["SP", 5, 10, 28, [1, 28, 1, 1], 1], ["SP", 5, 15, 28, [1, 1, 1, 1], 1], ["SP", 5, 20, 4, [1, 1, 2, 1], 1], ["SP", 5, 25, 16, [8, 2], 1], ["SP", 5, 28, 3, [1, 3], 1], ["SP", 5, 31, 3, [1, 3], 1], ["SP", 5, 34, 4, [1, 2], 1], ["RE", 5, [0, 5, 10, 15, 20, 1, 6, 11, 16, 21, 2, 7, 12, 17, 22, 25, 28, 31, 34, 26, 29, 32, 35, 3, 8, 13, 18, 23, 27, 30, 33, 36, 4, 9, 14, 19, 24]], ["FSP", 6, 0, 8, 3], ["FSP", 6, 4, 9, 3], ["FSP", 6, 8, 10, 3], ["FSP", 6, 12, 11, 3], ["FSP", 6, 16, 12, 3], ["RE", 6, [0, 4, 8, 12, 16, 1, 5, 9, 13, 17, 2, 6, 10, 14, 18, 3, 7, 11, 15, 19]], ["CA", 5, 6, 14], ["CHR", 4, "shared", [5]], ["CA", 5, 6, 18], ["CI", 4], ["CHR", 2, "shared", [6]], ["CA", 3, 7, 18], ["CI", 2], ["CI", 1], ["FU", 16, [0, 1, 2, 3]], ["SP", 16, 0, 100352, [32], 1], ["AN", 16, 0, 5], ["AN", 16, 1, 6], ["FU", 8, [0, 1, 2, 3, 4]], ["AN", 8, 0, 5], ["FU", 8, [1, 2, 3, 4, 5]], ["AN", 8, 1, 4], ["FU", 8, [2, 3, 4, 5, 6]], ["AN", 8, 2, 6], ["FU", 6, [0, 1, 2, 3, 4, 5]], ["SP", 6, 0, 384, [1], 1], ["AN", 6, 1, 2], ["FFSP", 6, 0, [12, 11, 10, 9, 8], 1, 1], ["AN", 6, 1, 6], ["FU", 3, [0, 1, 2, 3, 4]], ["SP", 3, 0, 96, [1], 1], ["AN", 3, 1, 2], ["FFSP", 3, 0, [12, 11, 10, 9, 8], 1, 1], ["AN", 3, 1, 6], ["PR", 7, 0, "auto_unroll_max_step$64"]]]], "r": [[0.000385379], 0, 7.73356, 1722425058], "v": "v0.6"}
{"i": [["[\"113370991bc27f5cd1de28d21f562292\", [1, 64, 56, 56], [128, 64, 3, 3], [1, 128, 28, 28]]", "cuda -keys=cuda,gpu -arch=sm_75 -max_num_threads=1024 -thread_warp_size=32", [-1, 16, 64, 49152, 2147483647, 1024, 8, 32], "", 0, []], [[], [["CI", 12], ["CI", 11], ["CI", 10], ["CI", 9], ["CI", 8], ["CI", 7], ["CI", 6], ["CHW", 5, "local"], ["SP", 5, 0, 1, [1, 1, 1, 1], 1], ["SP", 5, 5, 32, [1, 4, 1, 4], 1], ["SP", 5, 10, 28, [1, 14, 2, 1], 1], ["SP", 5, 15, 28, [4, 1, 1, 1], 1], ["SP", 5, 20, 4, [1, 1, 2, 2], 1], ["SP", 5, 25, 16, [2, 2], 1], ["SP", 5, 28, 3, [1, 1], 1], ["SP", 5, 31, 3, [1, 3], 1], ["SP", 5, 34, 4, [2, 2], 1], ["RE", 5, [0, 5, 10, 15, 20, 1, 6, 11, 16, 21, 2, 7, 12, 17, 22, 25, 28, 31, 34, 26, 29, 32, 35, 3, 8, 13, 18, 23, 27, 30, 33, 36, 4, 9, 14, 19, 24]], ["FSP", 6, 0, 8, 3], ["FSP", 6, 4, 9, 3], ["FSP", 6, 8, 10, 3], ["FSP", 6, 12, 11, 3], ["FSP", 6, 16, 12, 3], ["RE", 6, [0, 4, 8, 12, 16, 1, 5, 9, 13, 17, 2, 6, 10, 14, 18, 3, 7, 11, 15, 19]], ["CA", 5, 6, 14], ["CHR", 4, "shared", [5]], ["CA", 5, 6, 18], ["CI", 4], ["CHR", 2, "shared", [6]], ["CA", 3, 7, 18], ["CI", 2], ["CI", 1], ["FU", 16, [0, 1, 2, 3]], ["SP", 16, 0, 100352, [64], 1], ["AN", 16, 0, 5], ["AN", 16, 1, 6], ["FU", 8, [0, 1, 2, 3, 4]], ["AN", 8, 0, 5], ["FU", 8, [1, 2, 3, 4, 5]], ["AN", 8, 1, 4], ["FU", 8, [2, 3, 4, 5, 6]], ["AN", 8, 2, 6], ["FU", 6, [0, 1, 2, 3, 4, 5]], ["SP", 6, 0, 2304, [1], 1], ["AN", 6, 1, 2], ["FFSP", 6, 0, [12, 11, 10, 9, 8], 1, 1], ["AN", 6, 1, 6], ["FU", 3, [0, 1, 2, 3, 4]], ["SP", 3, 0, 240, [1], 1], ["AN", 3, 1, 2], ["FFSP", 3, 0, [12, 11, 10, 9, 8], 1, 1], ["AN", 3, 1, 6], ["PR", 7, 0, "auto_unroll_max_step$64"]]]], "r": [[0.00050365], 0, 6.31622, 1722425059], "v": "v0.6"}
{"i": [["[\"113370991bc27f5cd1de28d21f562292\", [1, 64, 56, 56], [128, 64, 3, 3], [1, 128, 28, 28]]", "cuda -keys=cuda,gpu -arch=sm_75 -max_num_threads=1024 -thread_warp_size=32", [-1, 16, 64, 49152, 2147483647, 1024, 8, 32], "", 0, []], [[], [["CI", 12], ["CI", 11], ["CI", 10], ["CI", 9], ["CI", 8], ["CI", 7], ["CI", 6], ["CHW", 5, "local"], ["SP", 5, 0, 1, [1, 1, 1, 1], 1], ["SP", 5, 5, 32, [1, 2, 8, 2], 1], ["SP", 5, 10, 28, [1, 28, 1, 1], 1], ["SP", 5, 15, 28, [2, 1, 1, 2], 1], ["SP", 5, 20, 4, [4, 1, 1, 1], 1], ["SP", 5, 25, 16, [2, 4], 1], ["SP", 5, 28, 3, [1, 1], 1], ["SP", 5, 31, 3, [1, 3], 1], ["SP", 5, 34, 4, [1, 1], 1], ["RE", 5, [0, 5, 10, 15, 20, 1, 6, 11, 16, 21, 2, 7, 12, 17, 22, 25, 28, 31, 34, 26, 29, 32, 35, 3, 8, 13, 18, 23, 27, 30, 33, 36, 4, 9, 14, 19, 24]], ["FSP", 6, 0, 8, 3], ["FSP", 6, 4, 9, 3], ["FSP", 6, 8, 10, 3], ["FSP", 6, 12, 11, 3], ["FSP", 6, 16, 12, 3], ["RE", 6, [0, 4, 8, 12, 16, 1, 5, 9, 13, 17, 2, 6, 10, 14, 18, 3, 7, 11, 15, 19]], ["CA", 5, 6, 14], ["CHR", 4, "shared", [5]], ["CA", 5, 6, 18], ["CI", 4], ["CHR", 2, "shared", [6]], ["CA", 3, 7, 18], ["CI", 2], ["CI", 1], ["FU", 16, [0, 1, 2, 3]], ["SP", 16, 0, 100352, [32], 1], ["AN", 16, 0, 5], ["AN", 16, 1, 6], ["FU", 8, [0, 1, 2, 3, 4]], ["AN", 8, 0, 5], ["FU", 8, [1, 2, 3, 4, 5]], ["AN", 8, 1, 4], ["FU", 8, [2, 3, 4, 5, 6]], ["AN", 8, 2, 6], ["FU", 6, [0, 1, 2, 3, 4, 5]], ["SP", 6, 0, 3072, [1], 1], ["AN", 6, 1, 2], ["FFSP", 6, 0, [12, 11, 10, 9, 8], 1, 1], ["AN", 6, 1, 6], ["FU", 3, [0, 1, 2, 3, 4]], ["SP", 3, 0, 80, [1], 1], ["AN", 3, 1, 2], ["FFSP", 3, 0, [12, 11, 10, 9, 8], 1, 1], ["AN", 3, 1, 6], ["PR", 7, 0, "auto_unroll_max_step$0"]]]], "r": [[0.000918691], 0, 4.18241, 1722425059], "v": "v0.6"}
{"i": [["[\"113370991bc27f5cd1de28d21f562292\", [1, 64, 56, 56], [128, 64, 3, 3], [1, 128, 28, 28]]", "cuda -keys=cuda,gpu -arch=sm_75 -max_num_threads=1024 -thread_warp_size=32", [-1, 16, 64, 49152, 2147483647, 1024, 8, 32], "", 0, []], [[], [["CI", 12], ["CI", 11], ["CI", 10], ["CI", 9], ["CI", 8], ["CI", 7], ["CI", 6], ["CHW", 5, "local"], ["SP", 5, 0, 1, [1, 1, 1, 1], 1], ["SP", 5, 5, 32, [2, 4, 1, 4], 1], ["SP", 5, 10, 28, [1, 7, 4, 1], 1], ["SP", 5, 15, 28, [1, 2, 2, 1], 1], ["SP", 5, 20, 4, [1, 1, 1, 4], 1], ["SP", 5, 25, 16, [1, 4], 1], ["SP", 5, 28, 3, [1, 3], 1], ["SP", 5, 31, 3, [1, 1], 1], ["SP", 5, 34, 4, [1, 2], 1], ["RE", 5, [0, 5, 10, 15, 20, 1, 6, 11, 16, 21, 2, 7, 12, 17, 22, 25, 28, 31, 34, 26, 29, 32, 35, 3, 8, 13, 18, 23, 27, 30, 33, 36, 4, 9, 14, 19, 24]], ["FSP", 6, 0, 8, 3], ["FSP", 6, 4, 9, 3], ["FSP", 6, 8, 10, 3], ["FSP", 6, 12, 11, 3], ["FSP", 6, 16, 12, 3], ["RE", 6, [0, 4, 8, 12, 16, 1, 5, 9, 13, 17, 2, 6, 10, 14, 18, 3, 7, 11, 15, 19]], ["CA", 5, 6, 14], ["CHR", 4, "shared", [5]], ["CA", 5, 6, 18], ["CI", 4], ["CHR", 2, "shared", [6]], ["CA", 3, 7, 18], ["CI", 2], ["CI", 1], ["FU", 16, [0, 1, 2, 3]], ["SP", 16, 0, 100352, [4], 1], ["AN", 16, 0, 5], ["AN", 16, 1, 6], ["FU", 8, [0, 1, 2, 3, 4]], ["AN", 8, 0, 5], ["FU", 8, [1, 2, 3, 4, 5]], ["AN", 8, 1, 4], ["FU", 8, [2, 3, 4, 5, 6]], ["AN", 8, 2, 6], ["FU", 6, [0, 1, 2, 3, 4, 5]], ["SP", 6, 0, 384, [1], 1], ["AN", 6, 1, 2], ["FFSP", 6, 0, [12, 11, 10, 9, 8], 1, 1], ["AN", 6, 1, 6], ["FU", 3, [0, 1, 2, 3, 4]], ["SP", 3, 0, 216, [1], 1], ["AN", 3, 1, 2], ["FFSP", 3, 0, [12, 11, 10, 9, 8], 1, 1], ["AN", 3, 1, 6], ["PR", 7, 0, "auto_unroll_max_step$64"]]]], "r": [[0.000682119], 0, 10.2023, 1722425060], "v": "v0.6"}
{"i": [["[\"113370991bc27f5cd1de28d21f562292\", [1, 64, 56, 56], [128, 64, 3, 3], [1, 128, 28, 28]]", "cuda -keys=cuda,gpu -arch=sm_75 -max_num_threads=1024 -thread_warp_size=32", [-1, 16, 64, 49152, 2147483647, 1024, 8, 32], "", 0, []], [[], [["CI", 12], ["CI", 11], ["CI", 10], ["CI", 9], ["CI", 8], ["CI", 7], ["CI", 6], ["CHW", 5, "local"], ["SP", 5, 0, 1, [1, 1, 1, 1], 1], ["SP", 5, 5, 32, [1, 2, 2, 8], 1], ["SP", 5, 10, 28, [1, 2, 2, 1], 1], ["SP", 5, 15, 28, [1, 14, 2, 1], 1], ["SP", 5, 20, 4, [4, 1, 1, 1], 1], ["SP", 5, 25, 16, [1, 4], 1], ["SP", 5, 28, 3, [3, 1], 1], ["SP", 5, 31, 3, [1, 1], 1], ["SP", 5, 34, 4, [4, 1], 1], ["RE", 5, [0, 5, 10, 15, 20, 1, 6, 11, 16, 21, 2, 7, 12, 17, 22, 25, 28, 31, 34, 26, 29, 32, 35, 3, 8, 13, 18, 23, 27, 30, 33, 36, 4, 9, 14, 19, 24]], ["FSP", 6, 0, 8, 3], ["FSP", 6, 4, 9, 3], ["FSP", 6, 8, 10, 3], ["FSP", 6, 12, 11, 3], ["FSP", 6, 16, 12, 3], ["RE", 6, [0, 4, 8, 12, 16, 1, 5, 9, 13, 17, 2, 6, 10, 14, 18, 3, 7, 11, 15, 19]], ["CA", 5, 6, 14], ["CHR", 4, "shared", [5]], ["CA", 5, 6, 18], ["CI", 4], ["CHR", 2, "shared", [6]], ["CA", 3, 7, 18], ["CI", 2], ["CI", 1], ["FU", 16, [0, 1, 2, 3]], ["SP", 16, 0, 100352, [32], 1], ["AN", 16, 0, 5], ["AN", 16, 1, 6], ["FU", 8, [0, 1, 2, 3, 4]], ["AN", 8, 0, 5], ["FU", 8, [1, 2, 3, 4, 5]], ["AN", 8, 1, 4], ["FU", 8, [2, 3, 4, 5, 6]], ["AN", 8, 2, 6], ["FU", 6, [0, 1, 2, 3, 4, 5]], ["SP", 6, 0, 768, [4], 1], ["AN", 6, 1, 2], ["FFSP", 6, 0, [12, 11, 10, 9, 8], 1, 1], ["AN", 6, 1, 6], ["FU", 3, [0, 1, 2, 3, 4]], ["SP", 3, 0, 240, [1], 1], ["AN", 3, 1, 2], ["FFSP", 3, 0, [12, 11, 10, 9, 8], 1, 1], ["AN", 3, 1, 6], ["PR", 7, 0, "auto_unroll_max_step$64"]]]], "r": [[0.00260244], 0, 6.16848, 1722425061], "v": "v0.6"}
{"i": [["[\"113370991bc27f5cd1de28d21f562292\", [1, 64, 56, 56], [128, 64, 3, 3], [1, 128, 28, 28]]", "cuda -keys=cuda,gpu -arch=sm_75 -max_num_threads=1024 -thread_warp_size=32", [-1, 16, 64, 49152, 2147483647, 1024, 8, 32], "", 0, []], [[], [["CI", 12], ["CI", 11], ["CI", 10], ["CI", 9], ["CI", 8], ["CI", 7], ["CI", 6], ["CHW", 5, "local"], ["SP", 5, 0, 1, [1, 1, 1, 1], 1], ["SP", 5, 5, 32, [2, 4, 2, 1], 1], ["SP", 5, 10, 28, [1, 4, 1, 1], 1], ["SP", 5, 15, 28, [1, 14, 2, 1], 1], ["SP", 5, 20, 4, [1, 1, 1, 1], 1], ["SP", 5, 25, 16, [1, 4], 1], ["SP", 5, 28, 3, [1, 1], 1], ["SP", 5, 31, 3, [3, 1], 1], ["SP", 5, 34, 4, [1, 2], 1], ["RE", 5, [0, 5, 10, 15, 20, 1, 6, 11, 16, 21, 2, 7, 12, 17, 22, 25, 28, 31, 34, 26, 29, 32, 35, 3, 8, 13, 18, 23, 27, 30, 33, 36, 4, 9, 14, 19, 24]], ["FSP", 6, 0, 8, 3], ["FSP", 6, 4, 9, 3], ["FSP", 6, 8, 10, 3], ["FSP", 6, 12, 11, 3], ["FSP", 6, 16, 12, 3], ["RE", 6, [0, 4, 8, 12, 16, 1, 5, 9, 13, 17, 2, 6, 10, 14, 18, 3, 7, 11, 15, 19]], ["CA", 5, 6, 14], ["CHR", 4, "shared", [5]], ["CA", 5, 6, 18], ["CI", 4], ["CHR", 2, "shared", [6]], ["CA", 3, 7, 18], ["CI", 2], ["CI", 1], ["FU", 16, [0, 1, 2, 3]], ["SP", 16, 0, 100352, [32], 1], ["AN", 16, 0, 5], ["AN", 16, 1, 6], ["FU", 8, [0, 1, 2, 3, 4]], ["AN", 8, 0, 5], ["FU", 8, [1, 2, 3, 4, 5]], ["AN", 8, 1, 4], ["FU", 8, [2, 3, 4, 5, 6]], ["AN", 8, 2, 6], ["FU", 6, [0, 1, 2, 3, 4, 5]], ["SP", 6, 0, 48, [1], 1], ["AN", 6, 1, 2], ["FFSP", 6, 0, [12, 11, 10, 9, 8], 1, 1], ["AN", 6, 1, 6], ["FU", 3, [0, 1, 2, 3, 4]], ["SP", 3, 0, 40, [1], 1], ["AN", 3, 1, 2], ["FFSP", 3, 0, [12, 11, 10, 9, 8], 1, 1], ["AN", 3, 1, 6], ["PR", 7, 0, "auto_unroll_max_step$0"]]]], "r": [[0.000239355], 0, 2.65267, 1722425061], "v": "v0.6"}
{"i": [["[\"113370991bc27f5cd1de28d21f562292\", [1, 64, 56, 56], [128, 64, 3, 3], [1, 128, 28, 28]]", "cuda -keys=cuda,gpu -arch=sm_75 -max_num_threads=1024 -thread_warp_size=32", [-1, 16, 64, 49152, 2147483647, 1024, 8, 32], "", 0, []], [[], [["CI", 12], ["CI", 11], ["CI", 10], ["CI", 9], ["CI", 8], ["CI", 7], ["CI", 6], ["CHW", 5, "local"], ["SP", 5, 0, 1, [1, 1, 1, 1], 1], ["SP", 5, 5, 32, [1, 8, 2, 2], 1], ["SP", 5, 10, 28, [2, 2, 7, 1], 1], ["SP", 5, 15, 28, [1, 1, 1, 7], 1], ["SP", 5, 20, 4, [1, 4, 1, 1], 1], ["SP", 5, 25, 16, [1, 2], 1], ["SP", 5, 28, 3, [1, 1], 1], ["SP", 5, 31, 3, [1, 1], 1], ["SP", 5, 34, 4, [2, 1], 1], ["RE", 5, [0, 5, 10, 15, 20, 1, 6, 11, 16, 21, 2, 7, 12, 17, 22, 25, 28, 31, 34, 26, 29, 32, 35, 3, 8, 13, 18, 23, 27, 30, 33, 36, 4, 9, 14, 19, 24]], ["FSP", 6, 0, 8, 3], ["FSP", 6, 4, 9, 3], ["FSP", 6, 8, 10, 3], ["FSP", 6, 12, 11, 3], ["FSP", 6, 16, 12, 3], ["RE", 6, [0, 4, 8, 12, 16, 1, 5, 9, 13, 17, 2, 6, 10, 14, 18, 3, 7, 11, 15, 19]], ["CA", 5, 6, 14], ["CHR", 4, "shared", [5]], ["CA", 5, 6, 18], ["CI", 4], ["CHR", 2, "shared", [6]], ["CA", 3, 7, 18], ["CI", 2], ["CI", 1], ["FU", 16, [0, 1, 2, 3]], ["SP", 16, 0, 100352, [32], 1], ["AN", 16, 0, 5], ["AN", 16, 1, 6], ["FU", 8, [0, 1, 2, 3, 4]], ["AN", 8, 0, 5], ["FU", 8, [1, 2, 3, 4, 5]], ["AN", 8, 1, 4], ["FU", 8, [2, 3, 4, 5, 6]], ["AN", 8, 2, 6], ["FU", 6, [0, 1, 2, 3, 4, 5]], ["SP", 6, 0, 12, [1], 1], ["AN", 6, 1, 2], ["FFSP", 6, 0, [12, 11, 10, 9, 8], 1, 1], ["AN", 6, 1, 6], ["FU", 3, [0, 1, 2, 3, 4]], ["SP", 3, 0, 390, [1], 1], ["AN", 3, 1, 2], ["FFSP", 3, 0, [12, 11, 10, 9, 8], 1, 1], ["AN", 3, 1, 6], ["PR", 7, 0, "auto_unroll_max_step$16"]]]], "r": [[0.00305582], 0, 5.13508, 1722425062], "v": "v0.6"}
{"i": [["[\"113370991bc27f5cd1de28d21f562292\", [1, 64, 56, 56], [128, 64, 3, 3], [1, 128, 28, 28]]", "cuda -keys=cuda,gpu -arch=sm_75 -max_num_threads=1024 -thread_warp_size=32", [-1, 16, 64, 49152, 2147483647, 1024, 8, 32], "", 0, []], [[], [["CI", 12], ["CI", 11], ["CI", 10], ["CI", 9], ["CI", 8], ["CI", 7], ["CI", 6], ["CHW", 5, "local"], ["SP", 5, 0, 1, [1, 1, 1, 1], 1], ["SP", 5, 5, 32, [8, 1, 4, 1], 1], ["SP", 5, 10, 28, [1, 7, 2, 1], 1], ["SP", 5, 15, 28, [1, 4, 1, 7], 1], ["SP", 5, 20, 4, [1, 2, 1, 1], 1], ["SP", 5, 25, 16, [1, 8], 1], ["SP", 5, 28, 3, [3, 1], 1], ["SP", 5, 31, 3, [1, 1], 1], ["SP", 5, 34, 4, [1, 1], 1], ["RE", 5, [0, 5, 10, 15, 20, 1, 6, 11, 16, 21, 2, 7, 12, 17, 22, 25, 28, 31, 34, 26, 29, 32, 35, 3, 8, 13, 18, 23, 27, 30, 33, 36, 4, 9, 14, 19, 24]], ["FSP", 6, 0, 8, 3], ["FSP", 6, 4, 9, 3], ["FSP", 6, 8, 10, 3], ["FSP", 6, 12, 11, 3], ["FSP", 6, 16, 12, 3], ["RE", 6, [0, 4, 8, 12, 16, 1, 5, 9, 13, 17, 2, 6, 10, 14, 18, 3, 7, 11, 15, 19]], ["CA", 5, 6, 14], ["CHR", 4, "shared", [5]], ["CA", 5, 6, 18], ["CI", 4], ["CHR", 2, "shared", [6]], ["CA", 3, 7, 18], ["CI", 2], ["CI", 1], ["FU", 16, [0, 1, 2, 3]], ["SP", 16, 0, 100352, [32], 1], ["AN", 16, 0, 5], ["AN", 16, 1, 6], ["FU", 8, [0, 1, 2, 3, 4]], ["AN", 8, 0, 5], ["FU", 8, [1, 2, 3, 4, 5]], ["AN", 8, 1, 4], ["FU", 8, [2, 3, 4, 5, 6]], ["AN", 8, 2, 6], ["FU", 6, [0, 1, 2, 3, 4, 5]], ["SP", 6, 0, 24, [1], 1], ["AN", 6, 1, 2], ["FFSP", 6, 0, [12, 11, 10, 9, 8], 1, 1], ["AN", 6, 1, 6], ["FU", 3, [0, 1, 2, 3, 4]], ["SP", 3, 0, 520, [1], 1], ["AN", 3, 1, 2], ["FFSP", 3, 0, [12, 11, 10, 9, 8], 1, 1], ["AN", 3, 1, 6], ["PR", 7, 0, "auto_unroll_max_step$64"]]]], "r": [[0.00209283], 0, 6.82756, 1722425063], "v": "v0.6"}
{"i": [["[\"113370991bc27f5cd1de28d21f562292\", [1, 64, 56, 56], [128, 64, 3, 3], [1, 128, 28, 28]]", "cuda -keys=cuda,gpu -arch=sm_75 -max_num_threads=1024 -thread_warp_size=32", [-1, 16, 64, 49152, 2147483647, 1024, 8, 32], "", 0, []], [[], [["CI", 12], ["CI", 11], ["CI", 10], ["CI", 9], ["CI", 8], ["CI", 7], ["CI", 6], ["CHW", 5, "local"], ["SP", 5, 0, 1, [1, 1, 1, 1], 1], ["SP", 5, 5, 32, [1, 1, 16, 2], 1], ["SP", 5, 10, 28, [1, 7, 1, 4], 1], ["SP", 5, 15, 28, [1, 7, 4, 1], 1], ["SP", 5, 20, 4, [1, 2, 1, 1], 1], ["SP", 5, 25, 16, [2, 1], 1], ["SP", 5, 28, 3, [3, 1], 1], ["SP", 5, 31, 3, [1, 3], 1], ["SP", 5, 34, 4, [4, 1], 1], ["RE", 5, [0, 5, 10, 15, 20, 1, 6, 11, 16, 21, 2, 7, 12, 17, 22, 25, 28, 31, 34, 26, 29, 32, 35, 3, 8, 13, 18, 23, 27, 30, 33, 36, 4, 9, 14, 19, 24]], ["FSP", 6, 0, 8, 3], ["FSP", 6, 4, 9, 3], ["FSP", 6, 8, 10, 3], ["FSP", 6, 12, 11, 3], ["FSP", 6, 16, 12, 3], ["RE", 6, [0, 4, 8, 12, 16, 1, 5, 9, 13, 17, 2, 6, 10, 14, 18, 3, 7, 11, 15, 19]], ["CA", 5, 6, 14], ["CHR", 4, "shared", [5]], ["CA", 5, 6, 18], ["CI", 4], ["CHR", 2, "shared", [6]], ["CA", 3, 7, 18], ["CI", 2], ["CI", 1], ["FU", 16, [0, 1, 2, 3]], ["SP", 16, 0, 100352, [32], 1], ["AN", 16, 0, 5], ["AN", 16, 1, 6], ["FU", 8, [0, 1, 2, 3, 4]], ["AN", 8, 0, 5], ["FU", 8, [1, 2, 3, 4, 5]], ["AN", 8, 1, 4], ["FU", 8, [2, 3, 4, 5, 6]], ["AN", 8, 2, 6], ["FU", 6, [0, 1, 2, 3, 4, 5]], ["SP", 6, 0, 2304, [3], 1], ["AN", 6, 1, 2], ["FFSP", 6, 0, [12, 11, 10, 9, 8], 1, 1], ["AN", 6, 1, 6], ["FU", 3, [0, 1, 2, 3, 4]], ["SP", 3, 0, 360, [1], 1], ["AN", 3, 1, 2], ["FFSP", 3, 0, [12, 11, 10, 9, 8], 1, 1], ["AN", 3, 1, 6], ["PR", 7, 0, "auto_unroll_max_step$64"]]]], "r": [[0.00162309], 0, 5.82866, 1722425063], "v": "v0.6"}
{"i": [["[\"113370991bc27f5cd1de28d21f562292\", [1, 64, 56, 56], [128, 64, 3, 3], [1, 128, 28, 28]]", "cuda -keys=cuda,gpu -arch=sm_75 -max_num_threads=1024 -thread_warp_size=32", [-1, 16, 64, 49152, 2147483647, 1024, 8, 32], "", 0, []], [[], [["CI", 12], ["CI", 11], ["CI", 10], ["CI", 9], ["CI", 8], ["CI", 7], ["CI", 6], ["CHW", 5, "local"], ["SP", 5, 0, 1, [1, 1, 1, 1], 1], ["SP", 5, 5, 32, [1, 1, 1, 16], 1], ["SP", 5, 10, 28, [1, 4, 1, 1], 1], ["SP", 5, 15, 28, [1, 28, 1, 1], 1], ["SP", 5, 20, 4, [1, 2, 1, 1], 1], ["SP", 5, 25, 16, [2, 1], 1], ["SP", 5, 28, 3, [1, 3], 1], ["SP", 5, 31, 3, [3, 1], 1], ["SP", 5, 34, 4, [2, 1], 1], ["RE", 5, [0, 5, 10, 15, 20, 1, 6, 11, 16, 21, 2, 7, 12, 17, 22, 25, 28, 31, 34, 26, 29, 32, 35, 3, 8, 13, 18, 23, 27, 30, 33, 36, 4, 9, 14, 19, 24]], ["FSP", 6, 0, 8, 3], ["FSP", 6, 4, 9, 3], ["FSP", 6, 8, 10, 3], ["FSP", 6, 12, 11, 3], ["FSP", 6, 16, 12, 3], ["RE", 6, [0, 4, 8, 12, 16, 1, 5, 9, 13, 17, 2, 6, 10, 14, 18, 3, 7, 11, 15, 19]], ["CA", 5, 6, 14], ["CHR", 4, "shared", [5]], ["CA", 5, 6, 18], ["CI", 4], ["CHR", 2, "shared", [6]], ["CA", 3, 7, 18], ["CI", 2], ["CI", 1], ["FU", 16, [0, 1, 2, 3]], ["SP", 16, 0, 100352, [32], 1], ["AN", 16, 0, 5], ["AN", 16, 1, 6], ["FU", 8, [0, 1, 2, 3, 4]], ["AN", 8, 0, 5], ["FU", 8, [1, 2, 3, 4, 5]], ["AN", 8, 1, 4], ["FU", 8, [2, 3, 4, 5, 6]], ["AN", 8, 2, 6], ["FU", 6, [0, 1, 2, 3, 4, 5]], ["SP", 6, 0, 288, [3], 1], ["AN", 6, 1, 2], ["FFSP", 6, 0, [12, 11, 10, 9, 8], 1, 1], ["AN", 6, 1, 6], ["FU", 3, [0, 1, 2, 3, 4]], ["SP", 3, 0, 36, [1], 1], ["AN", 3, 1, 2], ["FFSP", 3, 0, [12, 11, 10, 9, 8], 1, 1], ["AN", 3, 1, 6], ["PR", 7, 0, "auto_unroll_max_step$0"]]]], "r": [[0.00019787], 0, 3.50823, 1722425064], "v": "v0.6"}
{"i": [["[\"113370991bc27f5cd1de28d21f562292\", [1, 64, 56, 56], [128, 64, 3, 3], [1, 128, 28, 28]]", "cuda -keys=cuda,gpu -arch=sm_75 -max_num_threads=1024 -thread_warp_size=32", [-1, 16, 64, 49152, 2147483647, 1024, 8, 32], "", 0, []], [[], [["CI", 12], ["CI", 11], ["CI", 10], ["CI", 9], ["CI", 8], ["CI", 7], ["CI", 6], ["CHW", 5, "local"], ["SP", 5, 0, 1, [1, 1, 1, 1], 1], ["SP", 5, 5, 32, [1, 1, 8, 4], 1], ["SP", 5, 10, 28, [1, 14, 1, 2], 1], ["SP", 5, 15, 28, [1, 7, 2, 1], 1], ["SP", 5, 20, 4, [2, 2, 1, 1], 1], ["SP", 5, 25, 16, [1, 2], 1], ["SP", 5, 28, 3, [1, 1], 1], ["SP", 5, 31, 3, [1, 3], 1], ["SP", 5, 34, 4, [1, 4], 1], ["RE", 5, [0, 5, 10, 15, 20, 1, 6, 11, 16, 21, 2, 7, 12, 17, 22, 25, 28, 31, 34, 26, 29, 32, 35, 3, 8, 13, 18, 23, 27, 30, 33, 36, 4, 9, 14, 19, 24]], ["FSP", 6, 0, 8, 3], ["FSP", 6, 4, 9, 3], ["FSP", 6, 8, 10, 3], ["FSP", 6, 12, 11, 3], ["FSP", 6, 16, 12, 3], ["RE", 6, [0, 4, 8, 12, 16, 1, 5, 9, 13, 17, 2, 6, 10, 14, 18, 3, 7, 11, 15, 19]], ["CA", 5, 6, 14], ["CHR", 4, "shared", [5]], ["CA", 5, 6, 18], ["CI", 4], ["CHR", 2, "shared", [6]], ["CA", 3, 7, 18], ["CI", 2], ["CI", 1], ["FU", 16, [0, 1, 2, 3]], ["SP", 16, 0, 100352, [32], 1], ["AN", 16, 0, 5], ["AN", 16, 1, 6], ["FU", 8, [0, 1, 2, 3, 4]], ["AN", 8, 0, 5], ["FU", 8, [1, 2, 3, 4, 5]], ["AN", 8, 1, 4], ["FU", 8, [2, 3, 4, 5, 6]], ["AN", 8, 2, 6], ["FU", 6, [0, 1, 2, 3, 4, 5]], ["SP", 6, 0, 384, [1], 1], ["AN", 6, 1, 2], ["FFSP", 6, 0, [12, 11, 10, 9, 8], 1, 1], ["AN", 6, 1, 6], ["FU", 3, [0, 1, 2, 3, 4]], ["SP", 3, 0, 60, [1], 1], ["AN", 3, 1, 2], ["FFSP", 3, 0, [12, 11, 10, 9, 8], 1, 1], ["AN", 3, 1, 6], ["PR", 7, 0, "auto_unroll_max_step$512"]]]], "r": [[0.000461437], 0, 11.19, 1722425065], "v": "v0.6"}
{"i": [["[\"113370991bc27f5cd1de28d21f562292\", [1, 64, 56, 56], [128, 64, 3, 3], [1, 128, 28, 28]]", "cuda -keys=cuda,gpu -arch=sm_75 -max_num_threads=1024 -thread_warp_size=32", [-1, 16, 64, 49152, 2147483647, 1024, 8, 32], "", 0, []], [[], [["CI", 12], ["CI", 11], ["CI", 10], ["CI", 9], ["CI", 8], ["CI", 7], ["CI", 6], ["CHW", 5, "local"], ["SP", 5, 0, 1, [1, 1, 1, 1], 1], ["SP", 5, 5, 32, [2, 8, 1, 2], 1], ["SP", 5, 10, 28, [2, 7, 1, 2], 1], ["SP", 5, 15, 28, [1, 1, 14, 1], 1], ["SP", 5, 20, 4, [2, 2, 1, 1], 1], ["SP", 5, 25, 16, [2, 1], 1], ["SP", 5, 28, 3, [3, 1], 1], ["SP", 5, 31, 3, [3, 1], 1], ["SP", 5, 34, 4, [2, 2], 1], ["RE", 5, [0, 5, 10, 15, 20, 1, 6, 11, 16, 21, 2, 7, 12, 17, 22, 25, 28, 31, 34, 26, 29, 32, 35, 3, 8, 13, 18, 23, 27, 30, 33, 36, 4, 9, 14, 19, 24]], ["FSP", 6, 0, 8, 3], ["FSP", 6, 4, 9, 3], ["FSP", 6, 8, 10, 3], ["FSP", 6, 12, 11, 3], ["FSP", 6, 16, 12, 3], ["RE", 6, [0, 4, 8, 12, 16, 1, 5, 9, 13, 17, 2, 6, 10, 14, 18, 3, 7, 11, 15, 19]], ["CA", 5, 6, 14], ["CHR", 4, "shared", [5]], ["CA", 5, 6, 18], ["CI", 4], ["CHR", 2, "shared", [6]], ["CA", 3, 7, 18], ["CI", 2], ["CI", 1], ["FU", 16, [0, 1, 2, 3]], ["SP", 16, 0, 100352, [32], 1], ["AN", 16, 0, 5], ["AN", 16, 1, 6], ["FU", 8, [0, 1, 2, 3, 4]], ["AN", 8, 0, 5], ["FU", 8, [1, 2, 3, 4, 5]], ["AN", 8, 1, 4], ["FU", 8, [2, 3, 4, 5, 6]], ["AN", 8, 2, 6], ["FU", 6, [0, 1, 2, 3, 4, 5]], ["SP", 6, 0, 48, [1], 1], ["AN", 6, 1, 2], ["FFSP", 6, 0, [12, 11, 10, 9, 8], 1, 1], ["AN", 6, 1, 6], ["FU", 3, [0, 1, 2, 3, 4]], ["SP", 3, 0, 696, [1], 1], ["AN", 3, 1, 2], ["FFSP", 3, 0, [12, 11, 10, 9, 8], 1, 1], ["AN", 3, 1, 6], ["PR", 7, 0, "auto_unroll_max_step$64"]]]], "r": [[0.00253559], 0, 7.76315, 1722425066], "v": "v0.6"}
{"i": [["[\"113370991bc27f5cd1de28d21f562292\", [1, 64, 56, 56], [128, 64, 3, 3], [1, 128, 28, 28]]", "cuda -keys=cuda,gpu -arch=sm_75 -max_num_threads=1024 -thread_warp_size=32", [-1, 16, 64, 49152, 2147483647, 1024, 8, 32], "", 0, []], [[], [["CI", 12], ["CI", 11], ["CI", 10], ["CI", 9], ["CI", 8], ["CI", 7], ["CI", 6], ["CHW", 5, "local"], ["SP", 5, 0, 1, [1, 1, 1, 1], 1], ["SP", 5, 5, 32, [2, 4, 2, 1], 1], ["SP", 5, 10, 28, [1, 1, 1, 14], 1], ["SP", 5, 15, 28, [1, 7, 1, 1], 1], ["SP", 5, 20, 4, [1, 2, 2, 1], 1], ["SP", 5, 25, 16, [1, 2], 1], ["SP", 5, 28, 3, [3, 1], 1], ["SP", 5, 31, 3, [1, 3], 1], ["SP", 5, 34, 4, [2, 1], 1], ["RE", 5, [0, 5, 10, 15, 20, 1, 6, 11, 16, 21, 2, 7, 12, 17, 22, 25, 28, 31, 34, 26, 29, 32, 35, 3, 8, 13, 18, 23, 27, 30, 33, 36, 4, 9, 14, 19, 24]], ["FSP", 6, 0, 8, 3], ["FSP", 6, 4, 9, 3], ["FSP", 6, 8, 10, 3], ["FSP", 6, 12, 11, 3], ["FSP", 6, 16, 12, 3], ["RE", 6, [0, 4, 8, 12, 16, 1, 5, 9, 13, 17, 2, 6, 10, 14, 18, 3, 7, 11, 15, 19]], ["CA", 5, 6, 14], ["CHR", 4, "shared", [5]], ["CA", 5, 6, 18], ["CI", 4], ["CHR", 2, "shared", [6]], ["CA", 3, 7, 18], ["CI", 2], ["CI", 1], ["FU", 16, [0, 1, 2, 3]], ["SP", 16, 0, 100352, [32], 1], ["AN", 16, 0, 5], ["AN", 16, 1, 6], ["FU", 8, [0, 1, 2, 3, 4]], ["AN", 8, 0, 5], ["FU", 8, [1, 2, 3, 4, 5]], ["AN", 8, 1, 4], ["FU", 8, [2, 3, 4, 5, 6]], ["AN", 8, 2, 6], ["FU", 6, [0, 1, 2, 3, 4, 5]], ["SP", 6, 0, 144, [1], 1], ["AN", 6, 1, 2], ["FFSP", 6, 0, [12, 11, 10, 9, 8], 1, 1], ["AN", 6, 1, 6], ["FU", 3, [0, 1, 2, 3, 4]], ["SP", 3, 0, 348, [1], 1], ["AN", 3, 1, 2], ["FFSP", 3, 0, [12, 11, 10, 9, 8], 1, 1], ["AN", 3, 1, 6], ["PR", 7, 0, "auto_unroll_max_step$0"]]]], "r": [[0.000365216], 0, 4.71616, 1722425067], "v": "v0.6"}
